,body,created_utc,subreddit,post_id,author
1054,"Does the internet exist in Italy?

*Writing from my laptop in Milan*",2020-10-13 02:30:50,Bitcoin,j9ybbl,kprimice
1055,I have an idea. Check the sidebar ---&gt;,2020-10-13 02:01:36,Bitcoin,j9ybbl,soontobesilenced
1056,uh? using ad blocker here lol,2020-10-13 02:04:39,Bitcoin,j9ybbl,iguano80
1057,Turn it off for 5 seconds lol.,2020-10-13 05:30:48,Bitcoin,j9ybbl,Kenyanen
1058,Letteralmente qualsiasi exchange,2020-10-13 03:32:21,Bitcoin,j9ybbl,domenico128
1059,"So du btc, signò... che faccio, lascio?",2020-10-13 09:18:09,Bitcoin,j9ybbl,yKrfTsDTa
1060,Kraken? Bitstamp? Several other places,2020-10-13 04:17:46,Bitcoin,j9ybbl,roveridcoffee
1061,I used etoro a few years ago when I was living in Sicily.,2020-10-13 06:23:17,Bitcoin,j9ybbl,ItalianAlaskan
1062,"Hello [u/iguano80](https://www.reddit.com/user/iguano80/),

It looks like another user has already mentioned [Kraken](https://support.kraken.com/hc/en-us/articles/360030651871-What-is-Kraken-com-) here (Thank you!). Here's a link to share with your friend and it lists the steps to get started with Kraken: [How to Get Started with Kraken](https://support.kraken.com/hc/en-us/articles/201396417-Account-setup-how-to-get-started-with-Kraken-)

We welcome clients from all over the world, Italy being one of them! Here are our [available cryptocurrencies](https://support.kraken.com/hc/en-us/articles/360000678446-Cryptocurrencies-available-on-Kraken) which include Bitcoin and here is an overview of our super competitive [fees](https://support.kraken.com/hc/en-us/articles/360030303832-Overview-of-fees-on-Kraken).

Please feel free to reach out to me directly should you have any other questions or concerns.

Happy trading!

Sana from Kraken",2020-10-13 06:10:00,Bitcoin,j9ybbl,kraken-sana
1063,"You can buy, sell and store bitcoin from [CoinCorner](https://www.coincorner.com/) as Italy is one of our supported countries.

The process of setting up an account is super easy. Our ""average sign up to buy"" time is under 10 minutes.

Hope this is helpful and let me know if you need any more information.",2020-10-13 16:41:00,Bitcoin,j9ybbl,CoinCornerEthan
1064,Found this on Wayback machine from an investigative article into Hal Finney's involvement in Bitcoin. Did a bit of digging into the addresses and it checks out. Figured you might find this interesting too.,2020-10-12 13:31:58,Bitcoin,j9mh1x,cyberruss
1065,"It still looks a bit blurry, has Reddit recompressed it? Would you happen to have a link to the archived image?",2020-10-13 08:30:59,Bitcoin,j9mh1x,estradata
1066,"Sure, here's the link in Wayback machine. I think its a limitation of the source.
https://web.archive.org/web/20140326104029/http://www.forbes.com/sites/andygreenberg/2014/03/25/satoshi-nakamotos-neighbor-the-bitcoin-ghostwriter-who-wasnt/#42e4aeba4a37",2020-10-13 11:27:50,Bitcoin,j9mh1x,cyberruss
1067,In code we trust,2020-10-12 18:09:16,Bitcoin,j9mh1x,hich7
1068,a modern day einstein,2020-10-12 20:40:56,Bitcoin,j9mh1x,Cokezone17
1069,You mean from Hal to Hal,2020-10-13 00:20:58,Bitcoin,j9mh1x,orlong_
1070,"Yep, or Dave to Hal? I’m guessing no one is arguing for Craig to Hal....",2020-10-13 00:55:44,Bitcoin,j9mh1x,cyberruss
1071,Rip Hal.,2020-10-13 10:50:59,Bitcoin,j9mh1x,EthereumIsKing
1072,Damn that UI brings back memories,2020-10-12 18:31:32,Bitcoin,j9mh1x,bit0fun
1073,"Wow, a screenshot of Hal's wallet?

Incredible, thanks.",2020-10-12 21:34:05,Bitcoin,j9mh1x,dantheman2020
1074,One of the canonical artefacts (relics) in years to come?,2020-10-12 21:50:32,Bitcoin,j9mh1x,cyberruss
1075,"no dude. bitcoin is the investment. if you find an ""investment"" that only takes bitcoin, you're probably being scammed. mark my words.",2020-10-13 11:34:03,Bitcoin,ja4sj3,soontobesilenced
1076,"Don't think I'd ever invest my Bitcoin in anything.  Bitcoin would probably appreciate faster than, e.g., most startups anyway.",2020-10-13 11:14:57,Bitcoin,ja4sj3,Brettanomyces78
1077,Don't pick up nickels in front of a steam roller.,2020-10-13 15:32:38,Bitcoin,ja4sj3,facepalm5000
1078,It doesn't grow. It's not beans,2020-10-13 11:09:29,Bitcoin,ja4sj3,BismuthMoon
1079,Bitcoin isn't beans?  Oh shit.  All this time...,2020-10-13 11:13:36,Bitcoin,ja4sj3,Brettanomyces78
1080,I WILL LITERALLY SERK MY OWN DERK IF WE DONT HIT 12k TONERT,2020-10-13 09:40:31,Bitcoin,j9m516,bigsmokebaby69
1081,"The price run today makes me wonder which big company, are we going to find out, is buying a bunch of bitcoin for their treasury?",2020-10-13 05:01:53,Bitcoin,j9m516,MondayDynamo
1082,its speculators and bots following the SPY price. SPY had a big run today as well. Its not a coincidence. Bitcoin will reach 12400 when stocks hit all time high.,2020-10-13 06:16:34,Bitcoin,j9m516,ReSuLTStatic
1083,"Old coins waking up?

[A thousand Satoshi-era bitcoins just moved wallets for the first time in a decade](https://www.theblockcrypto.com/linked/80606/a-thousand-satoshi-era-bitcoins-just-moved-wallets-for-the-first-time-in-a-decade)",2020-10-13 04:35:35,Bitcoin,j9m516,PneumaticInstitution
1084,Drinks for everyone here if we hit $12k tonight,2020-10-13 03:42:19,Bitcoin,j9m516,DontBeAFlatlinerMan
1085,I'm just here for the drinks.,2020-10-13 04:47:09,Bitcoin,j9m516,MagicNoodle
1086,Still waiting on my whisky!,2020-10-13 04:36:13,Bitcoin,j9m516,PneumaticInstitution
1087,🥃,2020-10-13 04:37:11,Bitcoin,j9m516,DontBeAFlatlinerMan
1088,"$1212.12 incoming (maybe, who knows?)!!!",2020-10-13 04:19:15,Bitcoin,j9m516,AmazingSuperPupils
1089,At 12:12,2020-10-13 06:03:32,Bitcoin,j9m516,Satoshimoto9
1090,Don’t pull a MacAfee on this!,2020-10-13 04:11:15,Bitcoin,j9m516,MyAnusBleeding
1091, we will hit 12k,2020-10-13 03:44:55,Bitcoin,j9m516,hndrx_j
1092,Current BTC market cap=$214 billion | Bitcoin is a guppy in the ocean. I bet bitcoin crosses $1 trillion market cap in the next 1-5 years. Then it’s game on after that. | I’ll be patiently waiting until 2032-2036 to sell my bitcoin. When there is 112.5 - 56.25 bitcoin mined every day.,2020-10-13 03:23:01,Bitcoin,j9m516,WocketMan0351
1093,That's too far for me man,2020-10-13 06:11:15,Bitcoin,j9m516,whipstickagopop
1094,To each their own. Easier said than done most likely.,2020-10-13 11:56:46,Bitcoin,j9m516,WocketMan0351
1095,I ❤️ Bitcoin,2020-10-13 02:47:23,Bitcoin,j9m516,Hefty_Jicama
1096,Dayummm!,2020-10-12 22:55:43,Bitcoin,j9m516,Occams_shaving_soap
1097,Can someone do the math? What if half the Fortune 500 companies in the US dedicated 1% of their cash reserves to bitcoin? How much Bitcoin would that be at its current price?,2020-10-12 22:35:44,Bitcoin,j9m516,Zafriti
1098,"S&amp;P 500 is worth roughly 23 trillion, 1% is 230 billion. Doesn’t answer your question re:cash reserves, but gives you a sense of scale.",2020-10-12 22:47:59,Bitcoin,j9m516,asherlevi
1099,"Net wealth, assets, and peace of mind much healthier by the day. Hope y'all are doing better too.",2020-10-12 22:16:03,Bitcoin,j9m516,AmazingSuperPupils
1100,For the best memes - what are the best twitter profiles to follow?,2020-10-12 21:07:52,Bitcoin,j9m516,jat129
1101,"https://twitter.com/JimBTC has some good ones, https://twitter.com/coinsiglieri used to, but doesn't seem very active anymore",2020-10-12 21:56:41,Bitcoin,j9m516,TheGreatMuffin
1102,Thanks!,2020-10-12 22:01:27,Bitcoin,j9m516,jat129
1103,This bitcoin vidya is more fun on days like today,2020-10-12 20:31:56,Bitcoin,j9m516,Follow_youre_heart
1104,Whats vidya?,2020-10-12 22:11:45,Bitcoin,j9m516,parakite
1105,Pew Pew! Vidya games,2020-10-13 00:11:39,Bitcoin,j9m516,Follow_youre_heart
1106,500 coin sell wall evaporated in ten minutes. Bullish af 📈📈📈,2020-10-12 20:06:52,Bitcoin,j9m516,MisterReuben
1107,Reverse Bart pattern !!!,2020-10-12 19:53:59,Bitcoin,j9m516,heggen
1108,It's a TRAB,2020-10-12 21:41:52,Bitcoin,j9m516,agumonkey
1109,Why is btc shooting up $10 @ a time?,2020-10-12 19:53:24,Bitcoin,j9m516,onceuponbanana
1110,Because that’s how devalued dollars have become,2020-10-13 01:49:07,Bitcoin,j9m516,WocketMan0351
1111,12k today,2020-10-12 19:47:06,Bitcoin,j9m516,Allenxzz
1112,I hope so but i doubt so,2020-10-12 21:47:08,Bitcoin,j9m516,EpicRayy
1113,"Feel free to give this Daily Thread an upvote, since today it's unstickied in favour of the [Mentor Monday thread](https://www.reddit.com/r/Bitcoin/comments/j9oudz/mentor_monday_october_12_2020_ask_all_your/) (and of course feel welcome to participate in the latter!)  :)",2020-10-12 19:05:09,Bitcoin,j9m516,TheGreatMuffin
1114,Is there any need for the Monday mentor thread when there's already a Bitcoin Beginners thread pinned?,2020-10-12 21:31:15,Bitcoin,j9m516,DatGiantIsopod
1115,"I believe there is, as the other thread is a FAQ and the format is not encouraging for questions, as there is much less visibility for new comments.  

Based on my observations of the previous Mentor Monday threads they seem quite popular (at least when they're stickied) and help to encourage newcomers to ask away without cluttering the r/bitcoin/new page and it's just a nice diversion from the usual Daily Thread chatter :)",2020-10-12 21:41:55,Bitcoin,j9m516,TheGreatMuffin
1116,Fair dinkum. I just saw your other post about the daily thread being stickied within the Mentor one so that solves my issue as well (find it hard to find the daily thread on a Monday).,2020-10-13 00:58:36,Bitcoin,j9m516,DatGiantIsopod
1117,Please post this every Monday. I hate digging for the daily thread. I'm too lazy.,2020-10-12 19:08:50,Bitcoin,j9m516,MagicNoodle
1118,"Thanks for the gold, sir!  

Hehe, we always post a stickied link to the Daily in the Mentor Monday thread, so the laziest option would be to just click on the stickied MM thread and you'll see the link to the Daily right as the first comment. :)  

But will try to keep in mind to post this here next time as well, thanks for feedback!",2020-10-12 19:14:10,Bitcoin,j9m516,TheGreatMuffin
1119,"This is clutch info, stickie within the stickie. Noice.",2020-10-12 21:18:47,Bitcoin,j9m516,MagicNoodle
1120,"I have 14 ETH but i wanna trade it for btc. What do you guys think? ( its r/bitcoin, so...expecting yall to tell me to sell :p)",2020-10-12 17:27:49,Bitcoin,j9m516,Narrow_Story1851
1121,"For me, I think one should hold ETH because one sees value in the tech and the future of its use (or you don't care about any of it, you just want to trade things that have value in a market) but I don't compare the two.

One hold's bitcoin because one wants to own sound money.",2020-10-12 22:14:44,Bitcoin,j9m516,AmazingSuperPupils
1122,"My portfolio is 100% bitcoin. I think there's a decent chance this next cycle will be driven by corporations wanting a scarce reserve asset on their balance sheets. For this, bitcoin is a much more suitable choice than eth or any other altcoin. If you've followed bitcoin news recently you may have noticed both MicroStrategy and Square only bought bitcoin, no ETH, as emphasized in Jack's [tweet](https://twitter.com/jack/status/1314263584558391297).

Also highly recommend reading The Bitcoin Standard as to why bitcoin's monetary properties matter more than its technological properties. Not that the technology doesn't matter, more that the technology matters insofar as it supports the monetary properties, not the other way around. Understanding the monetary properties makes it easier to understand why alts are not a great long-term investment.",2020-10-12 21:49:00,Bitcoin,j9m516,scottmsul
1123,100% btc as a portion of your crypto? Or 100% with stocks too?,2020-10-13 04:19:47,Bitcoin,j9m516,Narrow_Story1851
1124,"I ended up keeping 5 eth, sold the rest and will DCA into btc/tech stocks with it.",2020-10-12 20:55:07,Bitcoin,j9m516,Narrow_Story1851
1125,Bitcoin &gt; ethereum,2020-10-12 20:46:57,Bitcoin,j9m516,GloriousGibbons
1126,"Ultimately, I sold all my Eth for bitcoin a few days ago. I just don't understand the fundamentals of Eth... far too confusing so it's hard to build conviction",2020-10-12 19:51:54,Bitcoin,j9m516,itisworking1
1127,"Eth is today lower in sats than what it was in apr-may 2016.

Its not keeping up. Sell it all.",2020-10-12 18:01:39,Bitcoin,j9m516,parakite
1128,"Don't sell all? Keep some in ETH, diversify.",2020-10-12 17:36:23,Bitcoin,j9m516,diimebag666
1129,"diversifying crypto isn't a good strategy IMO. Unless you invest only in shitcoins. If Bitcoin falls, all other altcoins will.",2020-10-12 20:44:37,Bitcoin,j9m516,BUY___BITCOIN
1130,"I'm pretty maxi on BTC but Eth does currently seem to have a use case for defi and so on. It confuses the hell out of me as to why, but it's tripled in value since I bought some awhile back.",2020-10-13 01:00:10,Bitcoin,j9m516,DatGiantIsopod
1131,"“Hey Derice, you rich?”... “No, mon.”",2020-10-12 16:36:14,Bitcoin,j9m516,SpockSays
1132,Free advice: hodl.,2020-10-12 14:44:37,Bitcoin,j9m516,theHODLguy
1133,Sup,2020-10-12 14:33:33,Bitcoin,j9m516,xanmoth
1134,"Govt can't ban secrets and passwords. Utter retardation whoever thinks this kind of shit can be enforced, or even passed. It would no doubt result in all out war in the streets. At least that's where I'd be.",2020-10-13 05:46:54,Bitcoin,j9yf22,soontobesilenced
1135,"If this is real, then crypto has won.",2020-10-13 05:13:18,Bitcoin,j9yf22,theworldvworlas
1136,This is a major win for open source software and the free software world.,2020-10-13 08:43:36,Bitcoin,j9yf22,mimblezimble
1137,FUD,2020-10-13 04:37:48,Bitcoin,j9yf22,Mark_Bear
1138,"The only thing that'll spill is the BTC spilling out of more 3rd parties and into personal secure wallets, sounds like a win to me!",2020-10-13 08:05:31,Bitcoin,j9yf22,Nichoros_Strategy
1139,Can we get a link to the story rather than the claim?,2020-10-13 09:37:50,Bitcoin,j9yf22,prescribed_advice
1140,"The problem is that these back doors can be found by rouge nations/state sponsored nations also.

This is dumb as fuck...its like shooting yourself in the foot.

These old fucks need to change their fundamental way of thinking when it comes to technology as a whole.

They are shockingly archaically stupid...",2020-10-13 13:55:47,Bitcoin,j9yf22,Khrimz000
1141,"What's ""the CME trend""?  

CME is the Chicago Mercantile Exchange, unless you're using the acronym to mean something else. It's an organization where futures contracts are traded. Doesn't make much sense, what you're saying.",2020-10-13 13:23:12,Bitcoin,ja8mh5,Brettanomyces78
1142,I have no idea... blows my mind as much as yours. I keep reading that CME will dictate the trend of the BTC futures.,2020-10-13 13:24:44,Bitcoin,ja8mh5,kpchicken2
1143,"If you don't know what you mean, how can you ask us?  My mind is not blown at all.  I just don't understand what you're asking.

If you mean to say the CME contracts lead the market, it's pretty easy to demonstrate this is not really the case.  I don't honestly feel like putting the work in to do so right now, but others have.  All you need to do is aggregate a bunch of spot and derivative contracts and look at very small time frames to see which market is leading.  CME never really has.  Sure, you could claim traders take positions on CME and then move the market on spot exchanges to realize CME gains, but that would be very tough to prove.

Anyway, you first need to ask a clear question if you want a real answer.",2020-10-13 13:29:09,Bitcoin,ja8mh5,Brettanomyces78
1144,"Gawd f*... you already lost me..! The thing is that people don’t really explain what they are talking about and expect noobs like me to understand it. Which, I know forsure that I don’t what wtf thier talking about or even know what I don’t know. Thus falling into this cycle of chasing my own tail.. thanks for you input tho.",2020-10-13 13:32:42,Bitcoin,ja8mh5,kpchicken2
1145,"I'm not trying to be snarky.

Do you have a link to something you read so I can try to decipher?",2020-10-13 13:34:12,Bitcoin,ja8mh5,Brettanomyces78
1146,I understand.. idk if I can even find the link.. it was more like people arguing with each other about BTC having a future or not &amp; having it to be based upon CME. Looks like imma have to youtube my education. LOL.,2020-10-13 13:46:43,Bitcoin,ja8mh5,kpchicken2
1147,Sorry I can't really help.  I'm still not sure if you're confusing having a future with having futures contracts.,2020-10-13 13:48:27,Bitcoin,ja8mh5,Brettanomyces78
1148,"Also, a curious question (and I don't mean to be rude), do you know what a futures contract is?",2020-10-13 13:33:16,Bitcoin,ja8mh5,Brettanomyces78
1149,Does CME have anything to do with the Up/Down trend of the BTC/USD price?,2020-10-13 13:54:45,Bitcoin,ja8mh5,kpchicken2
1150,"Maybe.  But it really depends on exactly what you mean.

Bitcoin is traded many places.  CME is one of those places.  I thing you're asking, generally, how influential the CME contracts are on the price of Bitcoin.  Does that sound vaguely right?

If that's the case, I think it's reasonable to ask if CME seems to be setting the pace, or some other exchange or exchanges are instead.  Recently, the best evidence I've seen (don't take this as gospel) is that spot markets seem to be leading (think, Coinbase, Finex, Binance, OKex, etc) and futures markets following.  No real way to know how OTC markets fit in (those are the 3 main types of markets: spot, futures/derivatives, OTC).

Now, are there times when futures markets lead?  Yes, they usually do.  Does CME lead the pack in that group?  I don't think so.  The open interest is usually lagging other contracts (meaning it's a smaller player), but it is the only main cash settled one, I think.  So it does have something of a special position.

Anyway, here's the tldr version if you ask me about CME in general.  Lots of people try to make CME futures into something bigger than it is, especially gaps and the like.  They usually don't provide any real evidence why we ought to care.  Lack of evidence means I ignore this talk as idle chatter.  But find me something specific and then I'll look into it, within reason.",2020-10-13 14:08:08,Bitcoin,ja8mh5,Brettanomyces78
1151,How do you know so much about it? Are there any resources/guidance/direction that you can provide for my education?,2020-10-13 16:01:56,Bitcoin,ja8mh5,kpchicken2
1152,"When you buy BTC from an exchange, it will be available to you in an ""account"" controlled by the exchange. That ""account"" is actually a type of Bitcoin wallet called a ""custodial"" wallet: For the duration of your coins existing on that exchange, the cryptographic keys used to secure those coins are controlled by the exchange, and not you.

You should therefore consider transferring those coins from the exchange's wallet to one controlled by you. Assuming you have one setup on your smartphone like BlueWallet, GreenWallet or whatever, it will provide you with a wallet address for sending funds to.

To send the coins from the exchange to your wallet, just type the address generated by your wallet into the field labeled ""send"" (or whatever your exchange labels it as) on the exchange itself, and wait up to an hour for the funds to appear on your wallet.

Take care when typing addresses! One mis-typed character and you'll receive nothing and the coins will be lost.

If you want to learn more, and start your journey down the rabbit hole, I (and many others) have benefited hugely from videos and presentations done by Andreas Antonopoulos. He's on Twitter and YouTube.

Once you've learned more, and you want to figure out which wallet best suits you (smartphone, hardware or desktop) then you're in luck, I built this for you :-) 

https://walletmatrix.app.

Good luck.",2020-10-13 03:15:16,Bitcoin,j9zb6j,therussdotcom
1153,"&gt;Take care when typing addresses! One mis-typed character and you'll receive nothing and the coins will be lost.

That is untrue. Addresses contain a checksum that prevents you from sending funds to a mistyped address.",2020-10-13 03:44:20,Bitcoin,j9zb6j,andreasma
1154,"Thanks for the correction Andreas. I've only read Mastering Bitcoin twice, I should probably know better :-)",2020-10-13 03:49:57,Bitcoin,j9zb6j,therussdotcom
1155,You're absolutely right! However the OP should be aware that some viruses will switch the copied address to another one the hacker controls. So they should double check the address listed on the exchange is the one being pasted into the wallet!,2020-10-13 05:09:45,Bitcoin,j9zb6j,reddit4485
1156,Great point to add!,2020-10-13 05:30:45,Bitcoin,j9zb6j,andreasma
1157,"That clears alot of things up! also so if i were to deposit BTC thats stored in lets say Trezor hardware wallet back to the exchange to sell the BTC, i would also type the wallet address and good to go? Also if im gonna buy/sell the btc in the same crypto exchanger, whats the point in storing it? is that like a must? hmhmm...",2020-10-13 03:19:56,Bitcoin,j9zb6j,Vergo27
1158,"I can address your first point about sending funds back to the exchange: Yes. It's the same process but reversed.

To your second point ""what's the point?"", I pointed that out in my first reply: Not your wallet? Then you have little control over what happens to them. You're treating your coins as you would your dollars and cents in a bank. But Bitcoin is decentralised, so there is no-one to turn to if your coins are lost or stolen. No helpline to call. With Bitcoin you are your own bank and as such you have absolute control over your fund's privacy and security. That's why there are so many wallets out there. Each one caters to different people's ""threat model"".",2020-10-13 03:27:32,Bitcoin,j9zb6j,therussdotcom
1159,Misinformation. No coins have ever been lost or stolen while in a Coinbase custodial account. Many people with wallets lose their bitcoin through phishing attacks and installing scam wallets while these losses never occur on Coinbase. And it is a childish fantasy to imagine that insiders at Coinbase will conspire to steal crypto assets from Coinbase. The only risk of a custodial account is from Coinbase's relationship with the legal system. The likelihood of freezing all bitcoin accounts is about the same as freezing all bank accounts. Very remote.,2020-10-13 04:44:54,Bitcoin,j9zb6j,Bitdigester
1160,"While I accept your general point, I'm not sure why you specify Coinbase which I make no mention of.",2020-10-13 04:53:58,Bitcoin,j9zb6j,therussdotcom
1161,"&gt; i would also type the wallet address

You would copy and paste the address, or if you're using a phone, you can scan the QR code version of the address

&gt; Also if im gonna buy/sell the btc in the same crypto exchanger, whats the point in storing it? is that like a must?

In 2014, the biggest exchange - Mtgox - lost all their customers' Bitcoin. In 2020, every exchange is the next Mtgox. Store your Bitcoin in your own wallet, or lose it",2020-10-13 13:24:49,Bitcoin,j9zb6j,igadjeed
1162,"It's WAY more complex, but just to simply. Every exchange has a specific wallet for your account. Every Bitcoin you buy or deposit on their site will end up in there.

Remember that ""not your keys, not your coins"", so those Bitcoins won't be actually yours until you move them to your own wallet. Every wallet has a unique public address (or public key), just like a bank account. You just need to share that address with anyone who is going to send you some BTC, like the exchange. After you click the ""withdraw"" button on the exchange it will ask you for your public address. They'll probably take a fee and send your money.

On the other side, you'll find another key in every wallet, the private key. This one is the one you should never share with anyone because it will help you  ""prove"" that you are the owner of that wallet, so you can spend the money in there. I started using a mobile wallet, Coinomi. It's pretty easy and works fine.

As I mentioned before, it's way more complex and there so many things I didn't mention that are really important, such as seed phrases and hardware wallets (which are way more secure, check them out). Before spending your money and buying Bitcoin, do your own long research. There are tons of videos on YouTube and valuable information here in this sub that you can use. Crypto is an amazing world that I'm sure you'll like. Enjoy it :)",2020-10-13 03:28:07,Bitcoin,j9zb6j,Falciani
1163,To simplify: ends un explaining everything.,2020-10-13 08:54:59,Bitcoin,j9zb6j,BankBailout
1164,Thanks :D,2020-10-13 08:56:45,Bitcoin,j9zb6j,Falciani
1165,"Address is like your bank account number . You can get as many account numbers as you want (they are all free). To withdraw you need the password for that account number. Your wallet keeps track of all the passwords of all your addresses through a master password , called the “seed” consisting of 12 or 24 words.

Cold storage is about where you store the passwords . If you store on your phone it is more dangerous as someone could hack your phone, on exchange is considered even more dangerous , as the exchange could go bankrupt or turn out to be run by scammers . 

Cold storage means that the passwords are stored on a device that you own , which is not connected to the internet. (This device could be a piece of paper with the passwords written on it , a computer , or a hardware wallet , or your brain, in which case people talk about a brain-wallet).

I should say that I am also a new learner so 
Be sure to read also the original places about this stuff (Bitcoin.org ) .",2020-10-13 03:20:08,Bitcoin,j9zb6j,Free-Syrup-6399
1166,"So if i were to get trezor a hardware-wallet, it would come with its wallet address and i would make passwords for it (on its software that i access via pc when its connected to the pc?) basically? so like to withdraw BTC to the wallet, i would first do the password on pc connected to the hardware and then i would put the wallet address in crypto exchange and it would send the BTC?",2020-10-13 03:36:58,Bitcoin,j9zb6j,Vergo27
