,body,created_utc,subreddit,post_id,author
432,That’s the wrong picture for your announcement. That round about is notoriously difficult to navigate and no one is insured whilst driving around it. All that pic tells me is that the new multi path payment is going to be a nightmare,2020-10-13 11:37:11,Bitcoin,ja0b52,BrotherVaelin
433,"Just to clear this up, it's not my announcement. I'm not affiliated with wallet of satoshi in any way. 

The roundabout may be difficult for a bunch of humans to navigate with big heavy vehicles, but not as a computer node in a data network. 
The point is there are multiple paths. No need to over think it.",2020-10-13 11:43:37,Bitcoin,ja0b52,Fly115
434,"&gt;No need to over think it.

Reminds me of a good life pro tip I saw on Reddit a few months ago - ""Don't be the guy that plays devil's advocate all the time"". It's annoying. No one likes you when you do it. Just like no one likes the guy that hyper analyzes every little thing. 

Control your monkey brains people.",2020-10-13 18:34:14,Bitcoin,ja0b52,Cryptolution
435,Why the picture from Place de l'Étoile on Bastille day? Is it for the multi-path payments thing?,2020-10-13 10:34:00,Bitcoin,ja0b52,gle42
436,Yes. Just a visual.,2020-10-13 10:59:01,Bitcoin,ja0b52,Fly115
437,I only see Mike Tyson saying multi pass.,2020-10-13 14:25:40,Bitcoin,ja0b52,osvalds1
438,"Great development. So many lightning skeptics talked about how people would end up just connecting to large nodes. Creating a centralized network, but now this is pointless. You can connect to a bunch of smaller nodes and split your payments instead.",2020-10-13 13:51:54,Bitcoin,ja0b52,funnybitcreator
439,this is great if you want visual payment,2020-10-13 14:12:57,Bitcoin,ja0b52,UziCooking
440,"what is a ""visual payment""?",2020-10-13 14:18:13,Bitcoin,ja0b52,nibbl0r
441,"That's good news for privacy activists! BTW, whar does the ""photo"" relate to?",2020-10-13 17:31:36,Bitcoin,ja0b52,SwapzoneIO
442,"""This explosive situation could make Bitcoin, the currency par excellence.""

Bitcoin is 'the currency par excellence"" from the start, some 12 years ago.

The banks/governments are just doing their utmost best to convince the rest of the population that has doubts.

I can only say: THANKS!",2020-10-13 16:48:43,Bitcoin,jaatnd,Btcyoda
443,"Turkey is finished, thanking its government that has done nothing but fill their own pockets for the past 18 years.",2020-10-13 17:45:12,Bitcoin,jabolh,puntsalot
444,Unfortunately seems so. Painful to watch as a local - but also an opportunity for hyperbitcoinisation among its public (one of top users globally already),2020-10-13 17:48:09,Bitcoin,jabolh,digitalmoneyguru
445,"Yeah quite interesting that, what are they using it for? I question weather its the same circle of people taking the cash and dumping into bitcoin?",2020-10-13 17:52:14,Bitcoin,jabolh,puntsalot
446,"yup we use it like physical gold. Unbanking ourselves before they pull a bail-in á la Cyprus, Lebanon or Argentina.

Ultimate store of value ⛓",2020-10-13 18:07:24,Bitcoin,jabolh,digitalmoneyguru
447,Bring us a chart with M2 please,2020-10-13 18:41:24,Bitcoin,jabolh,BUY___BITCOIN
448,"you go ahead, would be helpful. instead of ordering people around",2020-10-13 18:42:41,Bitcoin,jabolh,digitalmoneyguru
449,Eli5,2020-10-13 06:35:18,Bitcoin,ja1dkc,Magyars
450,orange coin number go up,2020-10-13 13:21:10,Bitcoin,ja1dkc,Bitcoin_to_da_Moon
451,"Lift the seat when you pee. Wipe butt when done if you go #2.

Wash hands after pee pee or poo poo.

When you are a big boy, learn how to ""research"" things you are interested in because gam gam won't be here to tell you what it all means.",2020-10-13 08:30:47,Bitcoin,ja1dkc,BeakMeat
452,"And honestly I typically do, but a lot of the new bitcoin dev is significantly above my head. My job isn't anywhere near this field but I strongly believe in the core principles of Bitcoin. Sometimes friendly community members are able to dumb things down for me and many others who are in a similar boat.

I don't always wash my hands after a pee pee though, unless I'm in a public restroom.",2020-10-13 08:46:10,Bitcoin,ja1dkc,Magyars
453,"don't listen to that guy, he is an asshole. tor is an anonymity network. they have upgraded one of the parts of their network to make it more secure and robust. this isn't something that most people need to worry about. most people won't use this, and most of the people that do won't need to worry which address scheme they are using because it will be handled automatically by the software.",2020-10-13 09:04:55,Bitcoin,ja1dkc,_risho_
454,You have a narrow view of reality.,2020-10-13 08:49:00,Bitcoin,ja1dkc,bearCatBird
455,take your rtfm attitude and stick it in your ass. you can't honestly expect normies to do a deep dive on the intricacies of the tor network to understand what this means. if you want to be a condescending dickhead go hang out elsewhere.,2020-10-13 09:06:46,Bitcoin,ja1dkc,_risho_
456,"Hasn't Bitcoin Core always gossiped its peer cache to connected peers? That's been the primary means for nodes to learn of each other, with the DNS seeds being a fallback.

And transaction propagation has always been a gossip protocol…  
""Hey, have you heard about transaction 1234?""  
""No, do tell!""  
""Well okay, so I heard about this transaction 1234. It spends these coins with these signatures and creates these coins with these redemption requirements."" Etc.",2020-10-13 08:16:44,Bitcoin,ja1dkc,whitslack
457,Gossiping about peer IP addresses and onion V2 addresses are in Bitcoin Core for many years. New is the V3 onion addresses.,2020-10-13 17:44:36,Bitcoin,ja1dkc,emzys
458,"It's been a really long time since I've looked into tor can you explain what has happened with this V2 versus V3?

The last time I looked into security it was mostly broken and development of new protocols like Sphinx. Are those new protocols adapted into new networks yet? Is v3 a significant security upgrade that prevents parties from flooding the network with compromised nodes to decrypt data?",2020-10-13 18:50:54,Bitcoin,ja1dkc,Cryptolution
459,Noice.,2020-10-13 14:12:05,Bitcoin,ja1dkc,pcvcolin
460,"&gt; US Dollar YTD: -3.48%

In which currency?",2020-10-13 04:25:06,Bitcoin,j9zhuv,loulan
461,That's the dxy index. So against EUR GBP YEN.,2020-10-13 04:27:05,Bitcoin,j9zhuv,digitalmoneyguru
462,Thanks for asking btw. Good occasion to clarify.,2020-10-13 04:27:33,Bitcoin,j9zhuv,digitalmoneyguru
463,It’s good point though because the BTC and Gold gains are denominated in USD (not the same basket of fiat currencies).  So we don’t have a consistent unit,2020-10-13 08:33:14,Bitcoin,j9zhuv,punchbagged
464,"you’re not wrong, but also contextually it’s still a decent comparison if you look at it the right way. 

the common unit (USD), which is the legal currency of the US, is down compared to other world powers’ currencies. fortunately for US Bitcoin and Gold owners, our assets are way up in value compared to that common unit.",2020-10-13 08:54:20,Bitcoin,j9zhuv,TotalMelancholy
465,You could adjust BTC and gold by the USD return in dxy so down 3.48%.,2020-10-13 16:40:39,Bitcoin,j9zhuv,JonnyLatte
466,fiat currencies are like parachutists without parachut,2020-10-13 13:20:37,Bitcoin,j9zhuv,Bitcoin_to_da_Moon
467,"2020 is not really a ""standard"" year but nevertheless I'll cheer the bitcoin lead along with you",2020-10-13 05:33:56,Bitcoin,j9zhuv,RedWineBlackPiano
468,cheer up,2020-10-13 05:34:32,Bitcoin,j9zhuv,digitalmoneyguru
469,It was a hell of a test.,2020-10-13 07:50:07,Bitcoin,j9zhuv,CaptainCaveSam
470,"And Bitcoin won. 

The bottom was $5500.",2020-10-13 09:03:39,Bitcoin,j9zhuv,BlandTomato
471,This year ain't over yet.,2020-10-13 10:46:48,Bitcoin,j9zhuv,1nv1s1blek1d
472,It’s only going to get higher by EOY,2020-10-13 11:17:00,Bitcoin,j9zhuv,Daleedge
473,How do you know?,2020-10-13 14:29:42,Bitcoin,j9zhuv,riisen
474,Crystal ball told me,2020-10-13 15:19:51,Bitcoin,j9zhuv,Daleedge
475,"Tesla YTD :\~500%

Amazon YTD: \_180%

Apple....

Netflix...

Square...",2020-10-13 12:53:32,Bitcoin,j9zhuv,Titanruss
476,let’s see 2021,2020-10-13 15:59:42,Bitcoin,j9zhuv,digitalmoneyguru
477,"False comparison. The dollar is designed to lose value. That's how they win. Govt has never been bigger.  

And gold has certainly gained more market cap than bitcoin.",2020-10-13 10:06:19,Bitcoin,j9zhuv,soontobesilenced
478,"Also, Bitcoin is still gaining traction and reaching a point where it can settle. It won’t increase by 60%+/year indefinitely. Kind of arbitrary comparison.

The point that it’s a better investment for now is clear, but that doesn’t seem like it’s the focus of this post. At some point it’ll become plenty more stable",2020-10-13 13:16:36,Bitcoin,j9zhuv,Jooylo
479,"Inflation gives the consumer the same anxiety that I felt as a kid playing those certain Super Mario levels where the screen continually moved and would force you off a cliff if you broke pace...

It keeps the consumer spending and keeps Wall Street continually making riskier moves in attempting to outpace it as well as their competition",2020-10-13 14:21:48,Bitcoin,j9zhuv,Lexsteel11
480,And here comes bitcoin,2020-10-13 18:12:56,Bitcoin,j9zhuv,tituspus
481,Dollar is designed to lose value if you look at price index figures. Not compared to other currencies.,2020-10-13 11:30:01,Bitcoin,j9zhuv,Michelvp75
482,For now...,2020-10-13 18:45:24,Bitcoin,j9zhuv,JustFoundItDudePT
483,gOlD hAS gAiNEd mORe MaRkET cAP tHaN bItcoIN !!!!!!!!!!!!!!!!!!!!!!!!,2020-10-13 12:46:39,Bitcoin,j9zhuv,I-Hate_Naggers
484,Post each of the last 10 years to be fair.,2020-10-13 03:18:08,Bitcoin,j9zhuv,smoothID
485,Fair to who? BTC would annihilate the other two over the last 10 years,2020-10-13 05:24:37,Bitcoin,j9zhuv,samanthamae
486,Go ahead and post the values. Hint - I doesn't annihilate.,2020-10-13 05:59:45,Bitcoin,j9zhuv,smoothID
487,"https://dcabtc.com?sd=2011-10-12&amp;sda=9_years&amp;f=weekly&amp;d=9_years&amp;ac=10000&amp;c=true

100US dollars  DCA investing weekly for last 9 years is $47,000 total invested in each asset. These values are in purchasing power today thus we can leave that amount for fiat saved under a mattress. 

Fiat value = $47,000

Bitcoin Investment Value = $13,670,858

Gold Investment  Value = $67,627

Stock index Investment  value = $72,342

---------------------------------------------------

Lump sum investing would only mean much more for Bitcoin as well",2020-10-13 06:57:54,Bitcoin,j9zhuv,bitusher
488,"Approximately zero people DCAed into bitcoin the first year. Bitcoin is more like a stock than it is the stock market. That’s a double edged sword.

Edit: said last year instead of first year. Dumb.",2020-10-13 07:37:59,Bitcoin,j9zhuv,TheAnalogKoala
489,"&gt;Approximately zero people DCAed into bitcoin last year.

You can't possibly believe this. Many people like myself DCA on a regular basis continuously year after year. Investing in a bear market is the best time to invest",2020-10-13 07:40:27,Bitcoin,j9zhuv,bitusher
490,"I’ve been doing weekly buys since 2015-ish.

I’m pretty happy with my return.

I’m happier with having free capital.",2020-10-13 07:51:00,Bitcoin,j9zhuv,xtal_00
491,Yeah I messed up my comment. Sorry. I was trying to say very few were investing super early where the first 100X came from.,2020-10-13 07:49:55,Bitcoin,j9zhuv,TheAnalogKoala
492,"Bitcoin is almost 12 years old so that is why I only went 9 years back . But you are right . Most ""earlier"" investors started in 2013 .

So lets run the numbers for 7 years 

https://dcabtc.com?sd=2013-10-12&amp;sda=7_years&amp;f=weekly&amp;d=7_years&amp;ac=10000&amp;c=true

Fiat value = $36,600

Bitcoin Investment Value = $529,594

Gold Investment Value = $54,735

Stock index Investment value = $50,384",2020-10-13 07:53:53,Bitcoin,j9zhuv,bitusher
493,Hard to argue with those results.,2020-10-13 08:01:16,Bitcoin,j9zhuv,TheAnalogKoala
494,"He did as the person asked, compared each of the last 9 years, so ""when"" people invested is completely irrelevant to his point.",2020-10-13 08:36:54,Bitcoin,j9zhuv,sreaka
495,You go ahead.,2020-10-13 03:45:34,Bitcoin,j9zhuv,digitalmoneyguru
496,Delete your cherrypicked post then.,2020-10-13 05:58:58,Bitcoin,j9zhuv,smoothID
497,Stop it. Get some help.,2020-10-13 06:07:53,Bitcoin,j9zhuv,digitalmoneyguru
498,I reported the post as misinformation. That helped.,2020-10-13 06:09:06,Bitcoin,j9zhuv,smoothID
499,You’re a child lmao.,2020-10-13 06:09:39,Bitcoin,j9zhuv,digitalmoneyguru
500,And you're an opportunistic liar farming for karma points with cherry picked data point.,2020-10-13 06:11:58,Bitcoin,j9zhuv,smoothID
501,"Cherry picking data is what a person does when they're trying to get someone onboard with an idea. This is celebrating a victory within a group of believers. 

Like imagine if a coach comes into the locker room and says ""We're doing great this year everybody we have the most yards out of any team this season."" And then someone in the room accuses the coach of cherry picking data. That's what you sound like.",2020-10-13 11:14:00,Bitcoin,j9zhuv,Youwinredditand
502,exactly,2020-10-13 18:13:51,Bitcoin,j9zhuv,digitalmoneyguru
503,We've been winning since 2010,2020-10-13 14:44:18,Bitcoin,j9zhuv,ElephantsAreHeavy
504,no doubt,2020-10-13 15:59:23,Bitcoin,j9zhuv,digitalmoneyguru
505,BITCHIN.,2020-10-13 11:37:15,Bitcoin,j9zhuv,turnedtable_
506,Now do TSLA,2020-10-13 18:11:58,Bitcoin,j9zhuv,tituspus
507,you go ahead lmao. I love these “do XYZ” posts. Ok let’s just list all the assets on the face of earth.,2020-10-13 18:12:51,Bitcoin,j9zhuv,digitalmoneyguru
508,I look at it like sure some stock might beat bitcoin but good luck finding it and investing  in it before it moons. Hindsight is always 2020,2020-10-13 18:34:02,Bitcoin,j9zhuv,isnormanforgiven
509,[Have some perspective ](https://youtu.be/ciB4ZiehEIs),2020-10-13 18:35:43,Bitcoin,j9zhuv,digitalmoneyguru
510,"Guys, take your head off the sand. The world is 8 billion. Who cares about the american stonks. It’s frustrating how arrogant this stocks vs BTC narrative is.",2020-10-13 18:35:05,Bitcoin,j9zhuv,digitalmoneyguru
511,"Yeah I'll stick to stonks then. Thankyou TSLA, AMZN, and NVDA 💕",2020-10-13 18:52:43,Bitcoin,j9zhuv,c12022
512,You do you,2020-10-13 18:55:08,Bitcoin,j9zhuv,digitalmoneyguru
513,Cherry-pick much?,2020-10-13 07:22:22,Bitcoin,j9zhuv,RedPill43
514,"It's just a YTD post, I saw YTD returns on S&amp;P, DOW, Nasdaq posted today on CNBC. So fucking what.",2020-10-13 08:39:00,Bitcoin,j9zhuv,sreaka
515,"Hi and welcome.  

Will try to answer briefly, although your questions have a lot of variables and subtleties, so keep that in mind please.  

&gt; However, if every merchant simply accepted Bitcoin, people can simply pay with their phones, without the need for cash. Everybody, and their grandmother, has a smartphone or two. Am I missing something here, or am I correct with the ease of use?  

You are correct, it's *relatively* easy to use. However, there is this thing about bitcoin that every transaction competes with every other transaction on the network for confirmations. This competition is resolved by fees attached to every transaction. In times where is not many tx's, it doesn't matter. But when a lot of tx's come into the network, the ones with the higher fees get priority over lower fee ones.  

This means that when there are a lot of tx's going on, either you have to wait longer times for confirmations, or you pay a higher fee. Usually the former is not a problem, your transaction will either get confirmed or doesn't leave your wallet. But people who are not familiar with how it works oftentimes freak out and think their transaction is ""stuck"".  

This might be a problem in real-life situations for people who are not familiar with bitcoin's quirks. That said, transactions are instantly visible in your recipient's wallet, it's just that the confirmations take time.    

Another possibility would be to use Lightning network which allows instant and almost fee-less payments (for a fraction of a cent), but it doesn't have a frictionless user experience either yet.  

&gt; The second problem we have is that nobody in Libya can be transferred money, from outside of Libya, even if Libyans had international friends and family willing to help them with money. But, with Bitcoin, you can simply transfer funds online with relative ease. Am I correct here, as well?  

I would say this is absolutely correct. Sending bitcoin over borders is as frictionless as sending a SMS to someone (and it cannot be stopped or censored like SMS can).  

&gt;  I have no idea whether or not Bitcoin is currently available in Libya; furthermore, I have no idea whether or not Bitcoin is legal in Libya (and, frankly, if the aforementioned problems can be solved, nobody will care about its ""legality""). So, can Bitcoin be adopted in Libya, with relative ease, without necessitating the banking system or government? Or would this undertaking be a major project?  

You don't need the banking system for bitcoin at all, so I would say it's easy in this regard.  

However, the vast majority of people will still need your local currency to pay for rent, food etc, and will probably need some ways to convert bitcoin into said local currency. So banks/governments could potentially make your life a little harder by refusing service (or imposing penalties, fines, bans etc) when they suspect the money has something to do with bitcoin.  

Summarized, I would say you generally are correct that bitcoin makes some of your usecases a little (or a lot) easier, but keep in mind that in practice there are a lot of quirks that need to be figured out or at least understood, so bitcoin is not a panacea either.  

Please also keep in mind that I am not an expert by any means, so it's all very subjective. I hope it's helpful in any way. Please feel free to ask more.",2020-10-13 06:09:05,Bitcoin,ja2hwt,TheGreatMuffin
516,"Thank you for the thorough response. Very helpful and appreciated. You do raise a few points that I'd like to address:  
(1) So, my understanding is that transactions may be slow in some circumstances. Frankly, I think one hour line-ups outside of grocery stores, with food in hand, waiting for transactions to go through, would be a non-issue, in comparison to days-long line-ups outside of banks with depleted reserves, just to end up going home empty handed. So, fortunately, I think this shouldn't be too much of a show-stopper, for now at least.

(2) However, the main point you bring up here is the ability, or rather inability, to convert Bitcoin to Libyan currency (i.e., dinars) for payments that require cash. Payments requiring cash, such as rent or utilities, may likely not change. However, I think a Bitcoin proposal would be meaningful to retailers like restaurants, moms and pops convenience stores, major grocery stores, gas stations, etc. Those were mainly what my idea was targeting. That said, you actually brought to my attention another issue, aside from the potential difficultly of converting Bitcoin to dinars. How does one even go about converting dinars to Bitcoin? I suspect a major retailer, like a grocery store, can be a Bitcoin dealer? Is that accurate? If so, how would this retailer have access to Bitcoin? And what would they do with the cash that they're being given in exchange for Bitcoin? How does the retailer digitally access Bitcoin's network and upload physical cash, without a digital wallet, since the only way Libya works is through cash?",2020-10-13 09:49:35,Bitcoin,ja2hwt,OkCheerio
517,"I’m not sure what the costs of living are in your country, but the fastest wat to get some bitcoin would be via donations, or from friends/relatives that live abroad. 
When there’s some bitcoin in your local network it can be enough for day to day trades. For example the store manager recieves bitcoin for groceries. He can Exchange these coins for Dinar with someone that wants to buy bitcoin. This way the bitcoin can reduce the need for cash in your community.
Would that be a solution for you?",2020-10-13 14:57:29,Bitcoin,ja2hwt,jepeperino
518,"&gt;(1) So, my understanding is that transactions may be slow in some circumstances. Frankly, I think one hour line-ups outside of grocery stores, with food in hand, waiting for transactions to go through, would be a non-issue, in comparison to days-long line-ups outside of banks with depleted reserves, just to end up going home empty handed. So, fortunately, I think this shouldn't be too much of a show-stopper, for now at least.

You should ignore that point. At this point, almost no body uses on-chain transactions. People use lightning wallets such as bluewallet, breez, wallet of satoshi, which do not cost much when doing lightning transactions. The process of owning bitcoin is much simpler with many of these wallets, if not with all ( custodial is simpler for user).  


So normal people are anyway going to use LN ( lightning network) of bitcoin, so fees are not a problem. these payments are very fast too.",2020-10-13 18:22:41,Bitcoin,ja2hwt,parakite
519,If you have the internet and smartphones then you have Bitcoin.  The only problem is on ramping people into it.,2020-10-13 06:07:50,Bitcoin,ja2hwt,Raverrevolution
520,"Okay, so how and where does one start? I think the first main issue we're immediately confronted with is, how Libyans can buy Bitcoin, within Libya. Say, for example, a person has an X amount of cash (which is all there is), what would the first step be to buy Bitcoin? Who/where do they give their Libyan Dinars to for Bitcoin to be reflected in their digital wallets on their smartphones?",2020-10-13 09:24:00,Bitcoin,ja2hwt,OkCheerio
521,"Oh man I'm really sorry.  I couldn't help you out there.  I would say that depending on the laws in your country you'd have to go through them to set up some sort of store front maybe.

Someone would have to have access to turning Libyan Dinars into Bitcoin.  That person could then just sell and transfer in person I guess.",2020-10-13 09:30:40,Bitcoin,ja2hwt,Raverrevolution
522,"No need to apologize! Your response was helpful. But, yeah, I think a local seller would be the only solution. And, even then, the seller would still somehow need digital access to sending that Libyan cash to the ""Bitcoin fund"". Pardon my Bitcoin jargon; this is all new to me.",2020-10-13 10:13:12,Bitcoin,ja2hwt,OkCheerio
523,Can you partner with an exchange and make and/or sell gift cards through money exchangers/street vendors?,2020-10-13 11:50:33,Bitcoin,ja2hwt,baconcheeseburgarian
524,"Within Libya who sell Bitcoin? I don't believe there is, as far as I'm aware. Or do you mean a network online that supports Libyan currency within their digital wallet, which would then enable the purchase of Bitcoin online? Because even that, I have yet to find a platform (digital wallet) that supports Libyan currency. If you know of anything, let me know!",2020-10-13 12:01:12,Bitcoin,ja2hwt,OkCheerio
525,"Getting a wallet that transacts in Bitcoin is the easy part.

The difficult part is finding a network that accepts Libyan dinar in exchange for Bitcoin.  I would look at money exchangers, the guys who exchange euro/dinar or usd/dinar or whatever currencies that are accepted as cash within Libya.  If you can get those guys to buy bitcoin or make it part of their business then you're giving a way to onboard users in Libya.",2020-10-13 12:17:55,Bitcoin,ja2hwt,baconcheeseburgarian
526,"Sounds like an uphill battle for sure.  Always great to hear people looking for new solutions to old problems.  

Does the typical customer and vendor have an internet connected device with them at all times?  Is there any private banking infrastructure in the country right now?",2020-10-13 06:02:01,Bitcoin,ja2hwt,randolphmd
527,"The typical customer would have access to 3G/LTE coverage on their smartphone, almost at all times; however, the vendor would most definitely have access to WiFi, at least, if not 3G/LTE. As for private banking, no there was only state-banking with Gaddafi, and only ""state"" banking now.",2020-10-13 07:05:36,Bitcoin,ja2hwt,OkCheerio
528,"Minimum things needed for using bitcoin are:

1. Phone ( or laptop/computer) which as wallet software, that stores bitcoin. So any user will need to have this. A single phone can have multiple wallets, of course, but typically an individual will want their own device. 
2. Working internet connection. At least while doing the transaction the internet connection should be there. So even if a user does not have internet connect at all times, if they can sync up once in a while, and can have internet connection WHILE making tx, that is accpetable. But ideal is internet connection at all time ( this from the perspective of btc spender. a reciever should have internet connection at all times).

If you have internet connection working, then this can go forward... Then you will need to promote it and it could possibly become more widespread.",2020-10-13 06:20:13,Bitcoin,ja2hwt,parakite
529,How do they buy bitcoin to even use? Post mail some one hella Lybian dollars then they send coin?,2020-10-13 06:32:39,Bitcoin,ja2hwt,Parking_Meater
530,"It will start with expats sending coins to their family/relatives.   


Spread from there.",2020-10-13 06:52:53,Bitcoin,ja2hwt,parakite
531,Same way you get anything else. find someone with what you want and trade them for it. There are a lot of people with Bitcoin.,2020-10-13 08:37:32,Bitcoin,ja2hwt,summertime_taco
