,body,created_utc,subreddit,post_id,author
0,"Please feel free to make [constructive edits](https://www.reddit.com/r/BitcoinWiki/wiki/rbitcoin_sticky) to the document, they will be implemented pending mod review.  Also if you have any beginner questions regarding bitcoin feel free to post them in the comments below, several community members are happy to help answer them.  Note that this thread will be moderated and non-constructive feedback will be removed.  Thanks and welcome to Bitcoin!",2020-07-31 21:55:49,Bitcoin,i19uta,BitcoinFan7
1,"If you're interested in knowing about upcoming advancements in Bitcoin, specifically Taproot, please read these threads:

* [Technical: The Path to Taproot Activation](https://www.reddit.com/r/Bitcoin/comments/hqzp14/technical_the_path_to_taproot_activation/)
* [Technical: Taproot: Why Activate?](https://www.reddit.com/r/Bitcoin/comments/hrlpnc/technical_taproot_why_activate/)",2020-08-01 17:06:15,Bitcoin,i19uta,BashCo
2,"&gt;Bitcoin Newcomers FAQ

I started to read a little bit and realized it was a long, thorough post, so have been saving it for a nice weekend read :-)",2020-08-01 17:25:59,Bitcoin,i19uta,darkestfoxnyc
3,If i transfer my coin into a ledger will the price still fluctuate like it would on the exchange?,2020-08-02 02:00:57,Bitcoin,i19uta,yeezy_boost350v2
4,"Yes, the price will always fluctuate because bitcoin is traded 24/7 worldwide on various exchanges. There are no trading hours. 

When you obtain a bitcoin (through work, gifting, exchanging it for fiat currency, etc.) it now becomes subject to these market fluctuations no matter where it is stored. 

Look at it similarly to owning a bar of gold. If you purchase a bar of gold, it's value in exchange for dollars will always change, even if you have it stored away in a safe vault. The same applies to bitcoin.",2020-08-02 02:47:14,Bitcoin,i19uta,AstarJoe
5,!lntip 32,2020-08-23 02:56:58,Bitcoin,i19uta,BubblegumTitanium
6,"Hi u/BubblegumTitanium, thanks for tipping u/AstarJoe **32** satoshis!
***
*[^(More info)](https://www.reddit.com/r/lntipbot/wiki/index) ^| [^(Balance)](https://www.reddit.com/message/compose/?to=lntipbot&amp;subject=balance&amp;message=!balance) ^| [^(Deposit)](https://www.reddit.com/message/compose/?to=lntipbot&amp;subject=deposit&amp;message=!deposit 10000) ^| [^(Withdraw)](https://www.reddit.com/message/compose/?to=lntipbot&amp;subject=withdraw&amp;message=!withdraw put_invoice_here) ^| ^(Something wrong?  Have a question?) [^(Send me a message)](https://www.reddit.com/message/compose/?to=drmoore718)*",2020-08-23 02:57:17,Bitcoin,i19uta,lntipbot
7,This is a great explanation.,2020-09-08 07:29:30,Bitcoin,i19uta,an525252
8,yes of course the only way i ever seen my crypto funds remain at same price was when i funded my trading account on hugos broker every other platforms so far follows the global bitcoin price,2020-09-20 15:17:16,Bitcoin,i19uta,beckerdaniel7
9,"The value is not attached to your individual bitcoins.  Value is of bitcoins as a whole.

You just have a stored amount  of bitcoin on your wallet that can be traded for whatever the current value is.",2020-10-09 06:04:49,Bitcoin,i19uta,MadZane
10,Are you keeping this post up for awhile? Would love to link to this from our site so newbies have a place where they can start watching videos and reading up!,2020-08-01 16:17:08,Bitcoin,i19uta,darkestfoxnyc
11,"This thread won't be deleted, but there may be times where it is temporarily unpinned in favor of something more time sensitive, like livestreams or technical developments, because reddit only allows two pinned posts at a time. This will not impact the link you share with others though.

After 6 months, the thread will be archived by reddit (no comments or votes possible) and we will post a new thread so people can continue participating. Much of the content will be the same, and the old thread will still be valid.",2020-08-01 17:10:15,Bitcoin,i19uta,BashCo
12,"Great, thank you, I'll link to this thread then! 🧡",2020-08-01 17:13:23,Bitcoin,i19uta,darkestfoxnyc
13,Wow,2020-08-02 02:05:53,Bitcoin,i19uta,russianstocks
14,"While I appreciate the thoroughness of this post, why did you completely avoid talking about Coinbase?

I know “not your keys not your coin” etc. but like it or not, exchanges like Coinbase will be at the forefront of mainstream adoption; the very audience this post is targeted at.",2020-08-01 18:34:35,Bitcoin,i19uta,SpaceHoppity
15,"I noticed Coinbase was left out as well. I personally felt it was ""easy"" buying Bitcoin off Coinbase \[Pro\], and then I transferred to my cold storage afterwards.",2020-08-01 20:46:23,Bitcoin,i19uta,Jeomite
16,"For newcomers to the cryptocurrency world who just want to buy a small amount whilst they learn more, as a service it’s ideal.",2020-08-01 21:48:49,Bitcoin,i19uta,SpaceHoppity
17,Yeah I saw that also buying bitcoin from coinbase is a whole lot easier,2020-08-20 17:11:44,Bitcoin,i19uta,Greengirl0
18,Yeah I guess it's a political thing. It's a shame because if not for Coinbase I probably wouldn't own any BTC right now. I came in a total noob and it was just what I needed.,2020-08-02 10:17:29,Bitcoin,i19uta,Tron_Passant
19,"It appears that Coinbase was left out due to fundamental disagreements between the mod team and the owners of Coinbase with respect to certain ways that the company interacts with regulatory agencies. 

Bitcoin proponents trend towards the freedom-loving, tech savvy, and libertarian-minded. These traits have often put this sub at odds with Coinbase who tend to follow a very ""straight and narrow"" approach to cooperating with regulators and supplying them with the information they ask for. 

Additionally, differences on scaling technology and methodology for conducting the scaling of bitcoin have also placed the sub at odds with Coinbase. 

Personally, I have always used their service for trading and even the occasional storage because frankly, their system is very mature and robust and has not failed to impress. TLDR; Coinbase is a very solid choice for trading bitcoin in the US.",2020-08-02 02:52:31,Bitcoin,i19uta,AstarJoe
20,Coinbase quite literally attacked the protocol and tried to lead a disastrous hardfork attempt. They are anti-bitcoin. Many regulatory compliant exchanges were listed so don't make up reasons. While it's true Coinbase currently participates in an attack on fungibility that's just a small part of their anti-bitcoin activity.,2020-08-03 23:28:55,Bitcoin,i19uta,MrRGnome
21,Robhinhood is left out as well,2020-10-09 21:35:04,Bitcoin,i19uta,TacticalWolves
22,Not sure how to edit but Bisq should be first in the list of exchanges. Not only is it alphabetically first but it should also be encouraged.,2020-08-01 05:53:40,Bitcoin,i19uta,RoscoRoscoMan
23,"I agree that we should encourage decentralized exchanges but it's a bit advanced for the newcomers, this is designed to be a gentle introduction.",2020-08-01 05:55:25,Bitcoin,i19uta,BitcoinFan7
24,Consider adding some of the p2p exchanges https://github.com/cointastical/P2P-Trading-Exchanges/ They are not fully decentralized but are still much less centralized than something like coinbase,2020-08-01 21:00:22,Bitcoin,i19uta,belcher_
25,"Welcome new Bitcoiners!! 

Recently, Bitcoin enthusiasts have been less focused on trading volatility and more intent on accumulating more Bitcoin over time-- or ""stacking sats."" 

I wrote this [article](https://ryze.substack.com/p/a-guide-to-stacking-sats) outlining 3 easy ways to stack sats and accumulate more Bitcoin over time. 

1. **Dollar-cost averaging**: buying $X amount of Bitcoin on a fixed time interval 
2. **Buying the dip**: purchasing Bitcoin when the price drops by a certain amount  
3. **Earning Bitcoin**: getting Bitcoin-back on purchases instead of cash-back or points

The article goes over how these three strategies can work, as well as some products that you can use to achieve them. 

Hope you guys find it informative!",2020-08-05 23:31:56,Bitcoin,i19uta,heist95
26,"Excellent guide. I'd add mention of /r/BitcoinBeginners. It's a great place for newcomers to ask questions, here on redit. They, as well, should point their users here for more advanced discussion.",2020-08-24 15:47:09,Bitcoin,i19uta,ZeroWithEverything
27,"Amen! And for intermediate users, answering noob questions is a great way to refine your know-how.",2020-08-25 19:56:22,Bitcoin,i19uta,ChuckShores
28,"Question about the Cash App. I've been using it for buying small amounts of Bitcoin, which is nice, especially when paired with the cash card that you can get. However, is the Cash App a proper ""wallet""? It never gave me a long list of phrases to write down like other wallets do, so am I correct in assuming that my money resides with Square Inc, and is dependent on their policies?",2020-08-30 23:32:42,Bitcoin,i19uta,patchymoose
29,"CashApp is not a wallet at all.  You don't own Bitcoin that's in your CashApp account, just an IOU.  You're right that it's more like a bank account, where the money is technically not yours, but you are granted legal access to it, for now.

Transfer it into a wallet of your choice.  Ideally one that runs on an independent machine that you normally keep offline, be it an old computer, old smartphone, ""paper wallet"", USB, or a dedicated hardware wallet like a Trezor.",2020-09-08 03:43:43,Bitcoin,i19uta,Turil
30,"Thanks. That was what my gut told me, but CashApp doesn't make it clear.",2020-09-08 04:33:55,Bitcoin,i19uta,patchymoose
31,Thanks a lot for this. Jumping into the space. Helps :),2020-08-03 14:10:02,Bitcoin,i19uta,scyneva
32,Could update the scam bit to specifically mention the YouTube as scams? Since they are still rife and YouTube don't care...,2020-08-04 19:40:25,Bitcoin,i19uta,DisorientedPanda
33,"Excellent FAQ, here is an second one I created that has replies of all the common scams to avoid.

https://www.reddit.com/r/BitcoinBeginners/comments/g42ijd/faq_for_beginners/",2020-08-10 06:00:26,Bitcoin,i19uta,bitusher
34,"In the simplest terms, its an internet stock-like currency which anyone can buy and earn money like stock market?",2020-08-22 05:20:05,Bitcoin,i19uta,awakenedblossom
35,That's a very simplified view but I guess I would have to say yes.,2020-08-23 23:44:20,Bitcoin,i19uta,BitcoinFan7
36,I am very new to this and I am trying to understand. Currently confused on the mining and blockchain of it,2020-08-24 01:08:43,Bitcoin,i19uta,awakenedblossom
37,"Large Funds Transfer (UK)

Hi, I currently live in the UK &amp; have a business out in South Africa, Cape Two. and a business partner in Dubai &amp; I need send profits from SA to Dubai through a UK Bank Account for a quicker transfer method. I am wanting to use CoinBase to convert the large funds to BTC, send the BTC to Another CoinBase account, Transfer the funds to my wallet and then withdraw the large funds to a UK Bank account and then send to Dubai. 

I wanted to come on here and find out if anyone thinks there is a problem with this from a legal standpoint?",2020-08-27 16:50:29,Bitcoin,i19uta,3Pins_Boro
38," 

Noob bitcoin user here. I started with blockchain wallet and purchased some coins recently. When I did it the exchange rate was at around $15,050. When I check the confirmation details it shows the exchange rate from 2 days earlier which was close to $15,500.

Is this a normal occurrence. I'm ok with the fees and can expect a bit of variance in the exchange rate as the market is always live. But damn they give me the exchange rate from 48 hours prior?",2020-08-30 10:47:13,Bitcoin,i19uta,kushblazers
39,"Most exchanges charge you ""hidden"" fees by elevating the exchange rate, as well as keeping some of your transaction fees.",2020-09-08 03:46:02,Bitcoin,i19uta,Turil
40,"Better to go with custody-free swaps. Try out decentralized exchanges that don't require the user to deposit into the platform but make use of protocols and applications which are in control of the user, i.e. multisig transactions, peer-to-peer, fully non-custodial, open-source wallets. Try Whalesheaven for OTC trades, which include these features, supporting Bitcoin, Ethereum, Litecoin, Omni layer.",2020-09-28 06:00:08,Bitcoin,i19uta,10orgs35
41,"Hey, first time poster. Been a lurker for longer than I can remember, exciting to finally participate! Relatively new to this, mostly just trade a bit on Robinhood as I learn. I have sort of silly question/thought. I was wondering, does anyone else notice the flood of incredibly negative bitcoin “articles” in the news section of robinhood at certain times? Prior to drops, there always seems to be 5+ pieces of doom and gloom speculation, potentially influencing panicky new hobby investors or newcomers like myself potentially. I know drops and corrections come with the territory. I also know Robinhood is not the preferred platform in any way here, and entails only speculation and not ownership. Probably attributing pattern and meaning to coincidence in retrospect? Thanks for all the posts and info and laughs, looking forward to continuing to learn!",2020-09-03 19:11:54,Bitcoin,i19uta,chaoticdecent
42,"Very good share, thank you!",2020-09-13 13:36:01,Bitcoin,i19uta,KHBlockchainTech
43,Thanks! This really helped me to understand...,2020-09-19 01:57:22,Bitcoin,i19uta,Dan94Sh
44,Glad you found it useful 😊,2020-09-19 04:53:05,Bitcoin,i19uta,BitcoinFan7
45,"Good post, i would only slightly caution about the third video linked, he makes some pretty outlandish claims, like comparing second life (a virtual reality world) to oculus rift (a virtual reality device) and because both are virtual reality, they belong to same category. That is like saying paypal belongs to same category as bitcoin, only true in the most simplifying, generalizing reductionist sense.",2020-08-02 17:37:50,Bitcoin,i19uta,varikonniemi
46,"I welcome alternative suggestions, I personally found his presentation very interesting and well formulated but am by no means married to it.",2020-08-02 18:19:09,Bitcoin,i19uta,BitcoinFan7
47,"I'm long btc but just curious, isn't there arguments against a fundamentally deflating currency? Like there's a reason nations try to devalue their currency to some extent.",2020-08-03 22:26:47,Bitcoin,i19uta,paul_walker_is_dead
48,The Keynesian reasoning is that it increases money velocity by encouraging spending due to devaluation if you just hold onto it.  This creates unsustainable economies based on debt though and is only a thinly veiled excuse to allow them to siphon your wealth away from you by eroding your purchasing power.  Saifdean Ammous covers it in great detail in the Bitcoin Standard and I highly recommend anyone interested in the nature of money and economics to give it a read.,2020-08-06 07:56:16,Bitcoin,i19uta,BitcoinFan7
49,"Hi, I have a question about taxes with Robinhood day trading for stocks and bitcoin. So I'm very new to Robinhood and investment in general. My question is about taxes. So i put 5k in Robinhood, play multiple day trades with stocks and bitcoin, made $600. I then withdraw 5k6 to my bank account, couple day later I put another 5k in, right now I'm down to 4k5. My question is if i quit right now do i get taxes on my short-live $600 or at the end of the year, because my total net gain is $100. I only have to pay taxes on that $100. Thanks",2020-08-04 21:07:42,Bitcoin,i19uta,taurus9415
50,"Every sale of bitcoin is a taxable event.  It may be short term or long term, capital gain or capital loss but it should all be reported.  Be very careful, it is easy to rack up a large tax liability without realizing it.",2020-08-04 21:30:37,Bitcoin,i19uta,BitcoinFan7
51,"thank you, I'm currently love playing with Bitcoin on Robinhood but thinking about if I get tax on every time I sale for a profit, at the end of the year, if I lose money on bitcoin on Robinhood, I also end up paying taxes scare me.",2020-08-04 22:10:36,Bitcoin,i19uta,taurus9415
52,Where is the bit about virtual wallets?,2020-08-05 07:48:01,Bitcoin,i19uta,hughvr
53,"&gt; There are many software wallet options to choose from [here](https://bitcoin.org/en/choose-your-wallet) depending on your use case.

Is this the section you were looking for?",2020-08-05 08:12:57,Bitcoin,i19uta,BitcoinFan7
54,"Yes, thank you.",2020-08-05 08:15:48,Bitcoin,i19uta,hughvr
55,noted!,2020-08-06 19:01:10,Bitcoin,i19uta,AdamCantor
56,Where can I see the full resolution version of the thumbnail?,2020-08-07 01:01:50,Bitcoin,i19uta,tookthisusersoucant
57,https://imgur.com/fYFBsqp,2020-08-07 01:23:19,Bitcoin,i19uta,BitcoinFan7
58,"I need some help or advice when it comes to converting my bitcoins back to cash, in order to transfer back to paypal/bank account. I have my bitcoins in coinbase. I’ve reached out to them multiple times, only to find that there is no way to speak with someone. Emailing is the only option and I don’t even think an actual person is replying to them. It’s just been extremely frustrating. It’s all obviously still new so I’d appreciate any additional help. Thanks",2020-08-09 20:32:18,Bitcoin,i19uta,missgonewiththewind
59,"Unfortunately your keys are with a third party so you are at the mercy of Coinbase to release your coins.  When you eventually get control of them I would advise moving off coinbase.  If you want to sell them for cash I would recommend CashApp or Gemini but just be aware they are also custodial so only transfer to them when you are ready to sell, otherwise keep them in a wallet that you control so you do not have to ask for permission to access your coins again.",2020-08-09 22:17:17,Bitcoin,i19uta,BitcoinFan7
60,"Is it possible to transfer bitcoins from coinbase to a different wallet.  I’ve never had the ones I have now in a wallet. If so, are you still able to convert them to usd?",2020-08-09 22:56:17,Bitcoin,i19uta,missgonewiththewind
61,"Once they allow you access to them you can send them wherever you please, ideally to a wallet where you alone control the keys so you are not relying on any third party for permission to use your coins.  Hardware wallets such as Trezor are the best for this from a convenience and security standpoint.  If you ever wanted to convert them to dollars you would have to send them to an exchange to sell (like cashapp or gemini) to sell for dollars then withdraw to your bank account.",2020-08-09 23:35:51,Bitcoin,i19uta,BitcoinFan7
62,Thank you so much. I appreciate you taking the time helping me get a better understanding of how everything works and the proper steps to take.,2020-08-10 02:10:45,Bitcoin,i19uta,missgonewiththewind
63,Happy to help.  Bitcoin has amazing potential to help humanity so just doing what I can to help people learn about it.,2020-08-10 02:20:47,Bitcoin,i19uta,BitcoinFan7
64,Yes it’s very easy,2020-08-26 05:31:33,Bitcoin,i19uta,JenniMax76
65,"Noobs:

KYC and AML will keep you hemmed up from doing pretty much anything for anywhere from 2 weeks to 3 months depending upon your jurisdiction and local regulatory guidelines. 

Exchanges are being actually over aggressive and going above and beyond the guidelines. Be mentally prepared.",2020-08-10 02:53:39,Bitcoin,i19uta,BlastCorporation
66,is it safe to buy a full bitcoin with physical cash?,2020-08-11 23:17:22,Bitcoin,i19uta,Conmanda1
67,"It depends whom you are buying it from and on the circumstances (obviously you shouldn't be buying from a stranger in a dark alley - try with smaller amounts first, in a public location). But in general, it's as safe as buying anything else with physical cash. You should wait for at least 1 confirmation though when buying larger amounts.",2020-08-27 15:41:46,Bitcoin,i19uta,TheGreatMuffin
68,[deleted],2020-08-14 01:37:48,Bitcoin,i19uta,[deleted]
69,"I do not advise blockchain.com for anything.  This is a good place to start  

https://bitcoin.org/en/choose-your-wallet

With hardware wallets you dont need to worry about protecting the  physical device due to theft, fire, lost, etc.  You just need to protect the seed words (a string of words that are generated when you create the wallet), with these words you can recreate the wallet even if the physical device is lost/stolen/destroyed.  That's why it's recommended to back up the seed words in a few different but secure locations, that way if any one location burnt down or whatever you could access them in another location and recover the wallet.",2020-08-14 01:44:14,Bitcoin,i19uta,BitcoinFan7
70,[deleted],2020-08-14 01:49:06,Bitcoin,i19uta,[deleted]
71,"Just wanted to add that hardware (physical) wallets will give you a seed word list for backup. That word list should be written down safely can be used to restore the wallet fully in case of loss, damage, theft. The main advantage to these devices is they simplify the secure storage of the seed (keys) for doing transactions. There are other methods but for most non-tech users this is the easy way to be safe online.",2020-08-17 07:00:52,Bitcoin,i19uta,jcoinner
72,Is it ok to post potential scams in this subreddit to help alert others?,2020-08-15 06:32:22,Bitcoin,i19uta,maximusred
73,"Scammers often post their scams under the guise of helping alert others in order to improve their SEO results and sucker even more people. It's not really advisable to post about every scam unless it's particularly novel and egregious, and hasn't been posted before.",2020-08-15 15:59:06,Bitcoin,i19uta,BashCo
74,"Is it ok if I DM you the details to review? I think it's pretty novel and almost caught me, but I'm not an expert in Bitcoin.",2020-08-16 03:50:14,Bitcoin,i19uta,maximusred
75,"I guess that's fine, but I think you probably know what my answer will be.",2020-08-16 03:51:17,Bitcoin,i19uta,BashCo
76,"Hmm..that I shouldn't? I'll skip it for now. I'm sure if they become successful, it'll start showing up in searches that it's a scam.",2020-08-16 03:56:24,Bitcoin,i19uta,maximusred
77,"No, that it's most likely a scam and should not be proliferated.",2020-08-16 03:57:51,Bitcoin,i19uta,BashCo
78,"I am 99.99% sure it's a scam, and I don't want others to fall for it, because it's really well done, but I don't want to assist them by posting about it either. One red flag is their website was created just this month, and I only found one result in trustpilot that it's scam but they don't post the details showing why it's a scam.

Anyway, appreciate you responding. I'll skip it for now. I think if anyone does come across it, if they do enough due diligence, they'll figure it out.",2020-08-16 04:02:32,Bitcoin,i19uta,maximusred
79,"It might be okay if you post a screenshot of it, but don't link to it directly.",2020-08-16 04:27:20,Bitcoin,i19uta,BashCo
80,Does every site that has options for purchases requires providing a video to verify identity? If so why? I think it is weird.,2020-08-16 05:21:22,Bitcoin,i19uta,Pele111
81,"Some sites require it, not all.  Depends on how diligent they feel they need to be to comply with AML/KYC.",2020-08-17 20:45:48,Bitcoin,i19uta,BitcoinFan7
82,nj,2020-08-20 22:14:44,Bitcoin,i19uta,Aspirinixdupin
83,"Secure - Encrypted cryptographically and can’t be brute forced or confiscated with proper key management such as hardware wallets.

Seems wrong. Nothing is encrypted.",2020-08-22 05:01:27,Bitcoin,i19uta,smoothID
84,"""ShakePay 	Generate one time use Visa cards in seconds""

is this true? I've never seen this feature",2020-08-28 08:33:15,Bitcoin,i19uta,akula1984
85,This is entirely the opposite of welcoming to newbies.  This is offensively overwhelming with unnecessary details.,2020-09-08 03:41:28,Bitcoin,i19uta,Turil
86,"So whats a Bitcoin? Oh, it is that. Thanks!",2020-09-08 08:22:02,Bitcoin,i19uta,Nighty722
87,"I want to buy a Trezor and set it up with Exodus wallet. What is the best practice for navigating to these websites to buy/download these products? While I do trust the Trezor link above in this post, I also recognize that following a link on reddit to buy your cold storage is likely NOT best practice. Is there a way to verify legitimacy once you are on either of these sites?",2020-09-09 12:10:18,Bitcoin,i19uta,mightyduck19
88,"trezor.io is the official site, bookmark it.  You can verify their PGP signature from their github/media channels if you want to go for extra security.",2020-09-10 20:19:46,Bitcoin,i19uta,BitcoinFan7
89,Thanks!,2020-09-10 21:40:47,Bitcoin,i19uta,mightyduck19
90,"I like the automatic flair in this sub 🥺

I hope that when I hit like 6 months, I still have the flair",2020-09-13 12:34:08,Bitcoin,i19uta,AllinTeslaCalls
91,"Generally they should vanish after 3 months, but sometimes Automod fails to clear them.",2020-09-13 17:16:40,Bitcoin,i19uta,BashCo
92,"When I make a transaction, how does my computer know where to send a transaction for confirmation?",2020-09-21 21:55:37,Bitcoin,i19uta,I_melt_jet_fuel
93,Transactions are broadcast to all nodes in a best effort basis.  The network of nodes confirms that the transaction is legitimate and the miners include it in a block.,2020-09-22 02:53:49,Bitcoin,i19uta,BitcoinFan7
94,"Hey guys, I'm completely new to the world of BCs and mostly act as a middleman who is totally inexperienced so please bear with me.  
  
When asking for a price per BC to sell/buy, most of the sellers/buyers simply give a percentage. For example (-1%) which is what most of the sellers/buyers give. Can someone explain what it exactly means?  
  
Also, as a middleman, what are things that I need to know from both buyers and sellers? Thanks.",2020-09-22 06:33:01,Bitcoin,i19uta,JaegarJaquez
95,"New to bitcoin, but have been researching for my paper for a while. One thing I never understood was how mining with your own CPU gets you bitcoin. If you get money by solving computational problems to confirm transactions, how does that get you bitcoin. You get traditional money by doing a useful task for someone, but how does confirming transactions become useful for anybody?",2020-09-24 05:49:09,Bitcoin,i19uta,brbinsky
