,body,created_utc,subreddit,post_id,author
720,Gold follows the same exact correlation with the Dow as BTC does homey. I’ve also “been around” since I got my first coins in 2012. Go take your negative shit somewhere else.,2020-10-13 04:24:48,Bitcoin,j9npcm,CallingGooses
721,Chamath is da man,2020-10-12 16:08:33,Bitcoin,j9npcm,ride_the_LN
722,He’s a bull bull bull,2020-10-12 21:32:57,Bitcoin,j9npcm,rapgab
723,we been knowing this for a while,2020-10-12 16:50:44,Bitcoin,j9npcm,Dillys619
724,It's arguably the greatest inflation hedge there is.,2020-10-12 19:05:40,Bitcoin,j9npcm,z3us
725,"Maybe, but the fact that a ""former Facebook exec"" believes in Bitcoin is pretty irrelevant. The fact that exec in large tech companies are excited about technology is hardly surprising...",2020-10-13 03:30:02,Bitcoin,j9npcm,loulan
726,"This is patently false. Stocks crush the total returns of gold over every single time period, 10yr 30yr 50yr etc.",2020-10-13 11:04:51,Bitcoin,j9npcm,lomohodler
727,"Bitcoin is way more than just the world's best inflation hedge.  

Bitcoin is an entirely new financial system. 

Bitcoin is a revolution. 

Bitcoin is freedom. 

Bitcoin is the future.",2020-10-12 19:20:55,Bitcoin,j9npcm,BlandTomato
728,*can be,2020-10-12 23:21:30,Bitcoin,j9npcm,CaptainCaveSam
729,Bitcoin already is the now. It will be the future as well.,2020-10-12 23:22:17,Bitcoin,j9npcm,BlandTomato
730,"I agree in spirit, but there are prerequisites  are for the masses to think like how we are thinking. That means:

•Understanding fractional reserve banking-among other things such as the boiling derivatives market-and its dangerous consequences. 

•withdrawing from the system as much as possible. 

•holding your private keys yourself instead of leaving them with a custodian.

•Taking an active role in research. 

The masses need to understand and do all of these things before bitcoin can be mass adopted in regards to achieving a more efficient and educated/questioning society, and not just as another asset controlled by the powers that be.",2020-10-12 23:51:34,Bitcoin,j9npcm,CaptainCaveSam
731,"Agreed. 

Good syllabus. Let's teach everyone we know that. 

Also, you should consider the minimum needed to bring in new Bitcoin users. I posit that the price alone is enough initial attention to draw people down the rabbit hole of Bitcoin. 

Just wanting to get in on a good investment is attention enough for most. Then as they go down the rabbit hole, they learn the deeper, more valuable info about Bitcoin like what you mentioned. 

The only people who needed to be technical minded enough to understand the entire nuts and bolts where the people who were on the Cypherpunk mailing list that Satoshi emailed the Bitcoin white paper to.",2020-10-12 23:57:31,Bitcoin,j9npcm,BlandTomato
732,"Public sentiment will change over time, but unfortunately most people will only get involved if the interests of crypto intersect with their own. 

That being said it’s hard and often futile to try and convince people to use crypto, especially when most people don’t want to invest. Unless you want to become a preacher, it’s best to just throw little jabs here and there around people for giggles. Or be socially acceptable and not mention it. It’ll work out nicely in the end for the responsible crypto user anyhow. 

Best to just stack sats and teach when more people want to listen.",2020-10-13 08:24:14,Bitcoin,j9npcm,CaptainCaveSam
733,"In my opinion this is the medium to long term best case scenario and position for Bitcoin as an asset class. 

It may prove in 40 / 50 / 60 years that Bitcoin replaces the Dollar, but the USD won’t go quietly in my opinion. 

First BTC was ignored and ridiculed, now it’s being integrated and positioned as a hedge (by some). 

Once that hedge position is solidified and proven in the market, Bitcoin can then threaten the position of the world’s reserve currency, but Bitcoin needs to be valued at several Trillions overall not Billions. 

The USD is currently seen as a safe haven against market volatility, and the most liquid asset that people flow into at turbulent times. 

Bitcoin has a lot to prove to make it a true genuine ‘insurance policy’.",2020-10-12 20:36:00,Bitcoin,j9npcm,ItsDelicous
734,Maybe people will use bitcoin or something like it for wealth storage but convert to Fiat when spending.,2020-10-12 21:09:08,Bitcoin,j9npcm,strategosInfinitum
735,A dying animal always makes a big sound before it passes.,2020-10-12 21:35:51,Bitcoin,j9npcm,SkankHuntForty22
736,“in case the central banks and governments of the world step on a landmine” is a choice quote,2020-10-13 04:09:00,Bitcoin,j9npcm,IAmSkolar
737,"This is a certainty. The fall of the U.S. dollar, as well as its inflation, will be endless.

Buying Bitcoin and keeping it safe means making sure you can sleep well at night, as he explains.",2020-10-12 20:40:27,Bitcoin,j9npcm,sylsau
738,I'm not surprised considering Facebook former attitude towards Bitcoin,2020-10-12 20:59:42,Bitcoin,j9npcm,AlexFilist
739,"Equity investments are insurance against the dollar, not other fiat currencies.",2020-10-12 20:35:24,Bitcoin,j9npcm,AriOccasionalContext
740,https://www.qtrex.io/?albertwipf,2020-10-12 22:54:08,Bitcoin,j9npcm,strawberryg59
741,"The more legitimate investors on traditional media channels advocate for Bitcoin, then the greater the chance the next bull run will be even greater than 2017",2020-10-12 23:25:37,Bitcoin,j9npcm,NiekeWeijs
742,"yeah, Chamath is into bitcoin... we get it.",2020-10-13 00:58:55,Bitcoin,j9npcm,alethia_and_liberty
743,No Shyte Sherlock! And fcuk Facebook,2020-10-13 05:23:06,Bitcoin,j9npcm,ZeitgeistGuy
744,Oh yes.,2020-10-13 06:13:29,Bitcoin,j9npcm,GreezyGreek
745,"I just need more help understanding how something so unstable can be treated the same as fiat currency like the euro.. companys having milions in bitcoin just to have the bitcoin halve the price and screwing the company into potential bankrupcy ... if bitcoin ever becomes viable to everybody, literally the world economy will be unpredictable. Someone smarter pls correct me where im wrong",2020-10-12 20:55:51,Bitcoin,j9npcm,PsychoticBolt
746,This article will answer your question and much more [The Bullish Case for Bitcoin](https://medium.com/@vijayboyapati/the-bullish-case-for-bitcoin-6ecc8bdecc1?source=linkShare-dbe7d39e538c-1602515629),2020-10-12 21:16:07,Bitcoin,j9npcm,Glue_CH
747,Volatility should not be a problem once mass adoption has taken place.,2020-10-12 20:58:44,Bitcoin,j9npcm,ccrider92
748,I figure that but getting to that point is going to cost a bit isnt it ?,2020-10-12 21:04:47,Bitcoin,j9npcm,PsychoticBolt
749,"Of course.  Just like retail stores installing credit card readers, it’s gonna take time and money for bitcoin to become accepted at every store location.",2020-10-12 21:11:42,Bitcoin,j9npcm,ccrider92
750,It’s like hopping on a solid first class sailboat while being on an old sinking polluting ship,2020-10-12 20:55:23,Bitcoin,j9npcm,dominic_decoco69
751,Aka schmuck insurance lol,2020-10-12 23:17:44,Bitcoin,j9npcm,becomethewater
752,"I don't understand some of you. 

If the USD tanks and goes to the shitter like some of you are hoping/predicting, then so does other currencies world wide. 

What the hell are you trading in your Bitcoin for after that? Hand woven garments? Rice and potatoes?

Surely it won't be cashed out for ""worthless"" currency. Then what will Bitcoin be ""worth""? A bunch of useless paper?",2020-10-12 23:02:44,Bitcoin,j9npcm,CryptoIsVaporware
753,"Haven't you seen the meme?

Neo: ""What are you saying? That some day I'll be able to sell my bitcoins for millions?""  
Morpheus: ""No. I'm saying that when you're ready, you won't have to.""

The endgame for Bitcoin isn't to be traded for fiat at all; it's to be traded for goods and services directly. Bitcoin is intended to be currency.",2020-10-13 00:41:58,Bitcoin,j9npcm,whitslack
754,Bitcoin is more likely to end up as a reserve asset backing other cryptocurrencies.,2020-10-13 02:10:35,Bitcoin,j9npcm,xtal_00
755,Why would anyone use a front for Bitcoin when they could just use the real thing?,2020-10-13 03:35:54,Bitcoin,j9npcm,whitslack
756,"&gt;Therefore, why on earth are central banks considering the issuance of their own currencies?

Desperation and Panic. They are entering uncharted territories with quantitative easing , bail ins , bail outs ,a now negative interest rates. The old model of the fascist relationship with banks is no longer giving them enough control so they are trying to create a more draconian currency they directly control",2020-10-13 09:23:09,Bitcoin,ja09tj,bitusher
757,"In the US, probably because ACH is outdated.",2020-10-13 05:45:59,Bitcoin,ja09tj,PRMan99
758,"if u read the report, its global banks from multiple countries working on this standard",2020-10-13 06:01:50,Bitcoin,ja09tj,87321
759,"""read the report?""

c'mon man, this is Reddit! as if...",2020-10-13 08:33:55,Bitcoin,ja09tj,BeakMeat
760,scared lol. these monsters are completely indifferent. they have nothing to worry about financially. they don't care about CBs existence. the entire world could crumble around them and they'd be fine.,2020-10-13 10:03:37,Bitcoin,ja09tj,soontobesilenced
761,Governments are losing control and that's their greatest fear. Democracy is dying and we're headed for collapse. In a full collapse scenario Bitcoin won't be very useful if the internet stops working. Guns and ammo are probably the best thing for survival.,2020-10-13 18:09:01,Bitcoin,ja09tj,AloneForever
762,"lol, sad but true. But I don't believe in a full collapse, at least not in this generation.",2020-10-13 18:18:13,Bitcoin,ja09tj,lofiler
763,It's coming sooner than you think.,2020-10-13 18:23:41,Bitcoin,ja09tj,AloneForever
764,"bla, bla, bla...",2020-10-13 16:26:42,Bitcoin,ja09tj,acefalo11
765,"Nice! Now that it's posted here, altcoindaily can report on it! #doyourownresearch",2020-10-13 17:32:08,Bitcoin,ja09tj,modulemodule
766,"The biggest world bankers are about as afraid of Bitcoin as they are the contents of my toilet bowl after a big pot of rice &amp; beans.

It's early yet.  You're talking about playing in the NFL when we're still learning to walk here.",2020-10-13 11:27:19,Bitcoin,ja09tj,Brettanomyces78
767,not only bitcoin but they also fear Libra (and others that will follow) and China,2020-10-13 13:27:17,Bitcoin,ja09tj,Bitcoin_to_da_Moon
768,"it's not a flash drive.  

bitcoin isn't tied to national currencies.  it's traded for them.

yes a hardware wallet is worth it. 

i'll let others answer the rest. anonymity is possible, but you need to learn more and be careful.",2020-10-13 11:28:53,Bitcoin,ja6x5m,soontobesilenced
769,"&gt;blockchain website

if you mean blockchain,info  DO NOT  use that website or wallet!",2020-10-13 13:40:39,Bitcoin,ja6x5m,Bitcoin_to_da_Moon
770,Noted. Thank you.,2020-10-13 13:51:50,Bitcoin,ja6x5m,imstressedman
771,"&gt; Where can I buy bitcoin without providing my identity?

Buy Bitcoin from your friends, in person, for cash, but not your buddy with the robinhood account, because he doesn't own Bitcoin  

See bitcoin.org for a  list of free Bitcoin wallet apps. Do not use the blockchain.com wallet, or any wallet not listed at bitcoin.org

&gt; Why is bitcoin tied to country currency?

If you want to buy a laptop for Bitcoin, you want to know how much Bitcoin to pay, and how much USD that's equal to

&gt; What will happen to bitcoin value if the country currency is worthless?

Bitcoin will be worth 1kg of rice. How much rice do you need to buy a laptop?",2020-10-13 11:49:53,Bitcoin,ja6x5m,igadjeed
772,"&gt; Bitcoin will be worth 1kg of rice. How much rice do you need to buy a laptop?

Probably at least 10.000 kg of rice if not 100.000",2020-10-13 13:08:27,Bitcoin,ja6x5m,tasmanoide
773,And 4 Litecoins,2020-10-13 13:20:05,Bitcoin,ja6x5m,igadjeed
774,"&gt; Buy Bitcoin from your friends, in person, for cash

Links for places to do this can be found here: https://github.com/cointastical/P2P-Trading-Exchanges",2020-10-13 17:54:58,Bitcoin,ja6x5m,belcher_
775,"Welcome, good for you, on track to owning some of the scarcest asset of the world. You're still early, so right on time! Here is some good information about bitcoin, wallets and what not. There's even a getting started section: [https://www.lopp.net/bitcoin-information.html](https://www.lopp.net/bitcoin-information.html)

This way in no time you can educate your friend, sounds like he could also use some bitcoin education! 

Good for you, you ask questions, never stop doing that! Don't trust, verify and stack sats and hodl. This will make sense to you later on!

Good luck, cheers!",2020-10-13 12:19:21,Bitcoin,ja6x5m,Limburg3rt
776,Thanks for the links.,2020-10-13 13:50:18,Bitcoin,ja6x5m,imstressedman
777,"&gt; If I buy bitcoin on coinbase website, how is it anonymous?

Bitcoin has the ability to be anonymous, but when you attach your SSN to it, it is obviously no longer anonymous.  All depends on whether or not you taint it with personal data.

&gt; If transfer my bitcoin to a hardware wallet (my buddy told me about ledger website where I can buy me a flash drive wallet thing) won't there be traces of where the bitcoin came from and the person identity? 

Yes... its called analytics.

&gt; Where can I buy bitcoin without providing my identity?

It's not obvious.  You have to search it out and pay for the privilege.  Here's a good starting spot: https://kycnot.me/

&gt; Is it worth buying the ledger flash drive s?

I prefer a different vendor, but HW wallets are generally always a good investment.  You can get some for $10 or some for $1000.  They are all good, but I wouldn't default to the most expensive one and assume its the best.

&gt; Why is bitcoin tied to country currency? What will happen to bitcoin value if the country currency is worthless?

Read up on economics and the Weimar Republic.  Their currency became worthless, but milk, bread, lumber and essentials kept their value (unlike the currency).  Many believe that bitcoin will be independent of the 10x, 100x fluctuations of currencies in collapse.  Venezuela certainly thinks so.",2020-10-13 12:30:55,Bitcoin,ja6x5m,brianddk
778,So many coins holy shit. I got a lot to learn.,2020-10-13 13:54:47,Bitcoin,ja6x5m,imstressedman
779,[removed],2020-10-13 14:36:38,Bitcoin,ja6x5m,[deleted]
780,"Make sure you inform your friend he doesnt have any bitcoin. Robinhood sells bitcoin contracts, its basically forex. You have no keys there, therefore you have no coins.Robinhood doesnt even have any keys themselves lol",2020-10-13 12:59:24,Bitcoin,ja6x5m,idonthaveausername24
781,"Stop calling it a ""ledger flash drive"". It's ""hardware wallet"" or simply just ""the ledger nano"".

&gt;Why is bitcoin tied to country currency

It's not...",2020-10-13 14:59:16,Bitcoin,ja6x5m,dlq84
782,Your buddy is an idiot. Do your own research.,2020-10-13 18:14:58,Bitcoin,ja6x5m,RonTurkey
783,"1. Correct.  There's no real anonymity when buying from a regulated exchange.  Your friend is almost entirely wrong.

2. Yes, the ledger (lower case, not upper case) is public and so the transfer will be easily traceable.

3. With fiat?  Very few places anymore.  Directly from someone.  Someone mentioned Bisq as an option lately, but I can't vouch for that.

4. Sure, Ledger (capital L) makes a great product.  It's a wallet, not a flash drive.

5. It's not ""tied to"" any currency, but there are trading pairs, like in any forex market.  Think of it this way, how else are you going to buy it?  Like in forex, if one currency goes down, the various trading pairs with other currencies will reflect the devaluation.

You're asking good questions.  Keep it up, and watch out for scammers.",2020-10-13 11:12:36,Bitcoin,ja6x5m,Brettanomyces78
784,"I just finish watching a video on Ledger Nano S so its not tied to my identity that's cool. Can I just ask someone (like my buddy, but he said he can't) to transfer me some bitcoin and I just give them money equivalent to the value of bitcoin? That will be anonymous right...at least for me?",2020-10-13 11:22:43,Bitcoin,ja6x5m,imstressedman
785,"Ask your friend to sell to you some bitcoins. You'll learn that at Robinhood he didn't have bitcoin but exposure to bitcoin price. You can't send bitcoins out of robinhood, you can only change them for dollars on their platform.
Getting your first bitcoin without identity rape is not easy on the land of the free. Ask a friend or use an ATM, then you can use Bisq with zelle or uspmo to trade peer to peer.",2020-10-13 13:06:19,Bitcoin,ja6x5m,tasmanoide
786,"If you know someone willing to sell, sure.  Nothing stopping that.  Just be very careful with strangers.",2020-10-13 11:23:43,Bitcoin,ja6x5m,Brettanomyces78
787,"1. There is no anonymity in Bitcoin. So yes they can just ask Coinbase
2. Yes there will be traces, there is no anonymity in Bitcoin, the best you can hope for is pseudonymity at this stage.  
3. From other people peer to peer. 
4. That is a individual choice, there are lots of different hardware wallets to chose from with pros and cons. 
5. It is not.",2020-10-13 13:03:49,Bitcoin,ja6x5m,Tellabobbob
788,You can Coinjoin your bitcoin using Samurai or Wasabi wallet to obfuscate the history of transactions. Also doing transactions on second layer protocols gives you anonymity like the Liquid network or Lightning network. In the future 99% usage of bitcoin will be higher up the tech stack. The base network is a maximally decentralised anchor of trust for the new digital economy.,2020-10-13 15:45:35,Bitcoin,ja6x5m,Leading_Zeros
789,"Ben, keep up the good work! I have been binge-watching your videos for several months now!",2020-10-13 06:52:14,Bitcoin,ja2ba5,---AverageJoe---
790,"Thanks for sharing, this is a very good material.",2020-10-13 18:25:58,Bitcoin,ja2ba5,lofiler
791,"&gt; I see this sometimes, where people mention to send all BTC holdings into 1 address during period of low network fees. But how does this practically work?  

Imagine that the bitcoin in your wallet are actual metal coins, like those in your ""real"" wallet. Now imagine that in one pocket you have $1 coin, and in other pocket you have 100 pennies. Both have the exact same value, but when you want to pay $1 to somebody, the 100 pennies will weight more and take more space than a $1 coin.  

This is exactly the same how bitcoin transactions (UTXOs) work. If you received 1 bitcoin through multiple transactions, and then send this bitcoin to somebody else, it will be more expensive compared to if you received 1 bitcoin in one transaction, and then send it forward to somebody else.  

So in periods where there are not many transactions on the network (= fees are low), some people take their 100 pennies and ""melt"" them down into $1 coin, so to speak. So in the future their transactions will potentially be cheaper.  

&gt; Would it require setting up a brand new wallet each time?  

No, any wallet can give you an infinite number of new addresses, so for consolidation you just need to take a previously unused address from your wallet and send all the funds to that new address. The transaction will be sent and needs to be confirmed, but the coins will basically never leave your wallet (because your private key controls all the addresses associated with your wallet).  

But beware, consolidation can have negative consequences for your privacy. F.ex if you have some coins that you acquired anonymously, and some coins that you acquired through an exchange which has your ID etc, by mixing those coins you give up the privacy of those anonymous coins.",2020-10-13 03:58:51,Bitcoin,ja00hu,TheGreatMuffin
792,"&gt;If you received 1 bitcoin through multiple transactions, and then send this bitcoin to somebody else, it will be more expensive compared to if you received 1 bitcoin in one transaction

Just a small nitpick, you can get 1 bitcoin in one transaction but as multiple UTXOs (coins), what you meant is to get 1 bitcoin as one UTXO (coin).",2020-10-13 06:58:59,Bitcoin,ja00hu,yahiheb
793,"Yep, good nitpick! :)",2020-10-13 07:17:24,Bitcoin,ja00hu,TheGreatMuffin
794,Do you keep your anonymous coins and exchange coins in separate wallets? Even if you keep them in different addresses they could still merge and create a mess when you get some change. No?,2020-10-13 12:58:04,Bitcoin,ja00hu,luc1232
795,So Bitcoin isn't fungible.,2020-10-13 05:32:06,Bitcoin,ja00hu,TibbersCrypto
796,"It's a bit more complicated than a simple yes or no question, and also depends on your exact definition of fungibility. But every on-chain transaction is public and forever on the blockchain, so if you linked it to your identity somehow, it's difficult to undo and easy to lose privacy for your other transactions, if you aren't careful enough.",2020-10-13 05:43:18,Bitcoin,ja00hu,TheGreatMuffin
797,Thanks for the downvote.,2020-10-13 06:24:43,Bitcoin,ja00hu,TibbersCrypto
798,"It wasn't me. I'll give you an upvote, will it make it any better? :)",2020-10-13 06:28:21,Bitcoin,ja00hu,TheGreatMuffin
799,"No, u ruined it!1",2020-10-13 13:33:45,Bitcoin,ja00hu,Bitcoin_to_da_Moon
800,"In the last 10 minutes , I just donated 100 HKD worth of Bitcoin to this charity( https://support.hongkongfp.com/) in Bitcoin in a non custodial manner. The Bitcoin wallet I used was Eclair.

Please let me know anything you can discover about this transaction regardless of all the details I told you about it.

I will be curious if you can find any details.",2020-10-13 08:09:20,Bitcoin,ja00hu,bitusher
801,Just because I dont have the chain analysis tools to do so doesn't mean it's fungible. It's at best sudo anonymous. What makes you think those chain analysis software don't work?,2020-10-13 08:51:46,Bitcoin,ja00hu,TibbersCrypto
802,"&gt;Just because I dont have the chain analysis tools to do so doesn't mean it's fungible.

Why would you need chain analysis tools ? I gave you the exact amount and very narrow window of time

Anyways , I gave you a glaring Hint by telling you the wallet I used. Can you figure out how even with sophisticated chain analysis tools that your task is practically impossible?

&gt;It's at best sudo anonymous.

I think you mean to say ""pseudonymous"" and that is for a small subset of Bitcoins transactions. Most transactions in Bitcoin are not recorded on the Bitcoin blockchain

&gt;What makes you think those chain analysis software don't work?

Because I studied Bitcoin and the tools chain analysis uses.

Why do you think most DNM txs are still in Bitcoin?",2020-10-13 08:55:54,Bitcoin,ja00hu,bitusher
803,"Well exchanges can black list addresses that are associated with hacks so it is not fungible. And Yes, I meant pseudonyms thanks. All Bitcoin transactions are recorded on the bitcoin block chain. If it's not done on chain then its anything but a Bitcoin transaction. Most DNM use btc because it's the easiest crypto to acquire but it's far from the most private.",2020-10-13 09:27:02,Bitcoin,ja00hu,TibbersCrypto
804,"&gt;Well exchanges can black list addresses that are associated with hacks so it is not fungible.

There are infinite amounts of addresses, this is futile. 

&gt; All Bitcoin transactions are recorded on the bitcoin block chain

No, the opposite is true. Most Bitcoin transactions are not recorded on the blockchain. 

&gt; If it's not done on chain then its anything but a Bitcoin transaction.

So , I'm sending an altcoin when I send bitcoin with my eclair wallet?

&gt;Most DNM use btc because it's the easiest crypto to acquire

Liquidity is one of the reasons , yes, the other reason is its trivial to be private with Bitcoin. 

Have you figured out yet why my tx is practically impossible to trace yet? It wasn't done from an exchange or custodial wallet offchain if that was your guess.",2020-10-13 09:31:00,Bitcoin,ja00hu,bitusher
805,I can't tell if you're trolling.,2020-10-13 09:49:03,Bitcoin,ja00hu,TibbersCrypto
806,"I'm not trolling but being very clear. I told you the wallet I used , eclair. This is a non custodial lightning wallet. I sent the donation via lightning as you can see that charity uses btcpay so accepts lightning txs . Sending bitcoin via lightning is extremely private and chain analysis tools are worthless with sending Bitcoin this way. This is the way most Bitcoin txs will occur in the future. More than half my txs today are with lightning . 

Most Bitcoin txs are not recording onchain. Other ways Bitcoin txs are sent -

**non custodial ways currently popular**

Sidechains like liquid that have Confidential transactions tech 

Lightning which is multihopped , multipath, onion routed offchain HTLC ""smart contract"" Bitcoin txs 

handing btc coins, paper wallets , or opendimes in person

**non custodial ways possibly popular in future**

Statechains

eltoo 

**custodial ways popular now**

Offchain custodial wallet to merchant or other custodial wallet

Offchain within exchanges (daytraders)

----------------------------------------

**Current ways to tx ~private onchain**

Send a payjoin tx (bluewallet/btcpay)

coinjoin your BTC (wasabi/samourai/joinmarket) 

Acquire bitcoins without ID (many ways)

---------------------

Do you have any questions?",2020-10-13 10:05:12,Bitcoin,ja00hu,bitusher
807,"Say you received 100 small payments in the past and now want to send all of it to somewhere else, for example to an exchange. That sucks. Because you'll have to pay 100x fee, for example 100x $2 = $200.

That's why you should wait for a low-fee season. Then you send all your money to an own address of yours. The fee for that will be 100x fee, for example 100x $0.03 = $3.

And now you won't have trouble sending your funds elsewhere even when high-fee seasons starts again. Because for the next transaction you'll only pay **1x** fee.",2020-10-13 05:00:06,Bitcoin,ja00hu,Realchacal
